2017-12-14|AALI|Astra Agro Lestari Tbk.|12825
2017-12-14|ABBA|Mahaka Media Tbk.|50
2017-12-14|ACES|Ace Hardware Indonesia Tbk.|1130
2017-12-14|ACST|Acset Indonusa Tbk.|2550
2017-12-14|ADES|Akasha Wira International Tbk.|935
2017-12-14|ADHI|Adhi Karya (Persero) Tbk.|1760
2017-12-14|ADMF|Adira Dinamika Multi Finance Tbk.|7100
2017-12-14|ADMG|Polychem Indonesia Tbk|224
2017-12-14|ADRO|Adaro Energy Tbk.|1805
2017-12-14|AGII|Aneka Gas Industri Tbk.|575
2017-12-14|AGRO|Bank Rakyat Indonesia Agroniaga Tbk.|530
2017-12-14|AGRO-W|Waran Seri II Bank Rakyat Indonesia Agro|400
2017-12-14|AGRS|Bank Agris Tbk.|242
2017-12-14|AHAP|Asuransi Harta Aman Pratama Tbk.|160
2017-12-14|AIMS|Akbar Indo Makmur Stimec Tbk|238
2017-12-14|AISA|Tiga Pilar Sejahtera Food Tbk.|428
2017-12-14|AKKU|Anugerah Kagum Karya Utama Tbk.|57
2017-12-14|AKRA|AKR Corporindo Tbk.|6300
2017-12-14|ALKA|Alakasa Industrindo Tbk|340
2017-12-14|ALMI|Alumindo Light Metal Industry Tbk.|200
2017-12-14|ALTO|Tri Banyan Tirta Tbk.|446
2017-12-14|AMAG|Asuransi Multi Artha Guna Tbk.|374
2017-12-14|AMFG|Asahimas Flat Glass Tbk.|6150
2017-12-14|AMIN|Ateliers Mecaniques D Indonesie Tbk.|374
2017-12-14|AMRT|Sumber Alfaria Trijaya Tbk.|670
2017-12-14|ANJT|Austindo Nusantara Jaya Tbk.|1225
2017-12-14|ANTM|Aneka Tambang (Persero) Tbk.|620
2017-12-14|APEX|Apexindo Pratama Duta Tbk.|1780
2017-12-14|APIC|Pacific Strategic Financial Tbk.|448
2017-12-14|APII|Arita Prima Indonesia Tbk.|208
2017-12-14|APLI|Asiaplast Industries Tbk.|77
2017-12-14|APLN|Agung Podomoro Land Tbk.|200
2017-12-14|ARII|Atlas Resources Tbk.|880
2017-12-14|ARMY|Armidian Karyatama Tbk.|167
2017-12-14|ARNA|Arwana Citramulia Tbk.|340
2017-12-14|ARTA|Arthavest Tbk|220
2017-12-14|ARTI|Ratu Prabu Energi Tbk|50
2017-12-14|ARTO|Bank Artos Indonesia Tbk.|170
2017-12-14|ASBI|Asuransi Bintang Tbk.|294
2017-12-14|ASGR|Astra Graphia Tbk.|1300
2017-12-14|ASII|Astra International Tbk.|8200
2017-12-14|ASJT|Asuransi Jasa Tania Tbk.|460
2017-12-14|ASMI|Asuransi Kresna Mitra Tbk.|875
2017-12-14|ASRI|Alam Sutera Realty Tbk.|348
2017-12-14|ASSA|Adi Sarana Armada Tbk.|214
2017-12-14|ATIC|Anabatic Technologies Tbk.|770
2017-12-14|AUTO|Astra Otoparts Tbk.|2180
2017-12-14|BABP|Bank MNC Internasional Tbk.|50
2017-12-14|BACA|Bank Capital Indonesia Tbk.|210
2017-12-14|BAJA|Saranacentral Bajatama Tbk.|157
2017-12-14|BALI|Bali Towerindo Sentra Tbk.|1500
2017-12-14|BAPA|Bekasi Asri Pemula Tbk.|89
2017-12-14|BATA|Sepatu Bata Tbk.|540
2017-12-14|BAYU|Bayu Buana Tbk|1350
2017-12-14|BBCA|Bank Central Asia Tbk.|20925
2017-12-14|BBHI|Bank Harda Internasional Tbk.|103
2017-12-14|BBKP|Bank Bukopin Tbk.|560
2017-12-14|BBMD|Bank Mestika Dharma Tbk.|1375
2017-12-14|BBNI|Bank Negara Indonesia (Persero) Tbk.|9100
2017-12-14|BBRI|Bank Rakyat Indonesia (Persero) Tbk.|3430
2017-12-14|BBTN|Bank Tabungan Negara (Persero) Tbk.|3390
2017-12-14|BBYB|Bank Yudha Bhakti Tbk.|310
2017-12-14|BCAP|MNC Kapital Indonesia Tbk.|1560
2017-12-14|BCIP|Bumi Citra Permai Tbk.|123
2017-12-14|BDMN|Bank Danamon Indonesia Tbk.|5625
2017-12-14|BEKS|Bank Pembangunan Daerah Banten Tbk.|50
2017-12-14|BELL|Trisula Textile Industries Tbk.|206
2017-12-14|BEST|Bekasi Fajar Industrial Estate Tbk.|254
2017-12-14|BFIN|BFI Finance  Indonesia Tbk.|685
2017-12-14|BGTG|Bank Ganesha Tbk.|80
2017-12-14|BHIT|MNC Investama Tbk.|95
2017-12-14|BIKA|Binakarya Jaya Abadi Tbk.|320
2017-12-14|BIMA|Primarindo Asia Infrastructure Tbk.|71
2017-12-14|BINA|Bank Ina Perdana Tbk.|920
2017-12-14|BIPI|Benakat Integra Tbk.|75
2017-12-14|BIPP|Bhuwanatala Indah Permai Tbk.|71
2017-12-14|BIRD|Blue Bird Tbk.|3460
2017-12-14|BISI|BISI International Tbk.|1770
2017-12-14|BJBR|Bank Pembangunan Daerah Jawa Barat dan B|2240
2017-12-14|BJTM|Bank Pembangunan Daerah Jawa Timur Tbk.|705
2017-12-14|BKSL|Sentul City Tbk.|138
2017-12-14|BKSL-W|Waran Seri I Sentul City Tbk.|46
2017-12-14|BKSW|Bank QNB Indonesia Tbk.|200
2017-12-14|BLTZ|Graha Layar Prima Tbk.|9975
2017-12-14|BMAS|Bank Maspion Indonesia Tbk.|330
2017-12-14|BMRI|Bank Mandiri (Persero) Tbk.|7500
2017-12-14|BMSR|Bintang Mitra Semestaraya Tbk|230
2017-12-14|BMTR|Global Mediacom Tbk.|550
2017-12-14|BNBA|Bank Bumi Arta Tbk.|266
2017-12-14|BNBR|Bakrie & Brothers Tbk|50
2017-12-14|BNGA|Bank CIMB Niaga Tbk.|1250
2017-12-14|BNII|Bank Maybank Indonesia Tbk.|268
2017-12-14|BNLI|Bank Permata Tbk.|600
2017-12-14|BOGA|Bintang Oto Global Tbk.|615
2017-12-14|BOLT|Garuda Metalindo Tbk.|930
2017-12-14|BPFI|Batavia Prosperindo Finance Tbk.|430
2017-12-14|BRMS|Bumi Resources Minerals Tbk.|66
2017-12-14|BRPT|Barito Pacific Tbk.|2420
2017-12-14|BSDE|Bumi Serpong Damai Tbk.|1615
2017-12-14|BSIM|Bank Sinarmas Tbk.|880
2017-12-14|BSSR|Baramulti Suksessarana Tbk.|2300
2017-12-14|BTEK|Bumi Teknokultura Unggul Tbk|68
2017-12-14|BTEL|Bakrie Telecom Tbk.|50
2017-12-14|BTON|Betonjaya Manunggal Tbk.|112
2017-12-14|BTPN|Bank Tabungan Pensiunan Nasional Tbk.|2520
2017-12-14|BUDI|Budi Starch & Sweetener Tbk.|94
2017-12-14|BUKK|Bukaka Teknik Utama Tbk.|1380
2017-12-14|BULL|Buana Listya Tama Tbk.|153
2017-12-14|BULL-W|Waran Seri II Buana Listya Tama Tbk.|67
2017-12-14|BUMI|Bumi Resources Tbk.|256
2017-12-14|BUVA|Bukit Uluwatu Villa Tbk.|550
2017-12-14|BVIC|Bank Victoria International Tbk.|232
2017-12-14|BWPT|Eagle High Plantations Tbk.|182
2017-12-14|BYAN|Bayan Resources Tbk.|10550
2017-12-14|CANI|Capitol Nusantara Indonesia Tbk.|270
2017-12-14|CARS|Industri dan Perdagangan Bintraco Dharma|1120
2017-12-14|CASA|Capital Financial Indonesia Tbk.|374
2017-12-14|CASS|Cardig Aero Services Tbk.|775
2017-12-14|CEKA|Wilmar Cahaya Indonesia Tbk.|1320
2017-12-14|CENT|Centratama Telekomunikasi Indonesia Tbk.|81
2017-12-14|CFIN|Clipan Finance Indonesia Tbk.|282
2017-12-14|CINT|Chitose Internasional Tbk.|330
2017-12-14|CKRA|Cakra Mineral Tbk.|74
2017-12-14|CLEO|Sariguna Primatirta Tbk.|825
2017-12-14|CLPI|Colorpak Indonesia Tbk.|900
2017-12-14|CMNP|Citra Marga Nusaphala Persada Tbk.|1460
2017-12-14|CMPP|Rimau Multi Putra Pratama Tbk.|246
2017-12-14|CNKO|Exploitasi Energi Indonesia Tbk.|50
2017-12-14|CNTX|Century Textile Industry Tbk.|478
2017-12-14|COWL|Cowell Development Tbk.|860
2017-12-14|CPIN|Charoen Pokphand Indonesia Tbk|3330
2017-12-14|CPRO|Central Proteina Prima Tbk.|50
2017-12-14|CSAP|Catur Sentosa Adiprana Tbk.|440
2017-12-14|CSIS|Cahayasakti Investindo Sukses Tbk.|790
2017-12-14|CTRA|Ciputra Development Tbk.|1195
2017-12-14|CTTH|Citatah Tbk.|103
2017-12-14|DART|Duta Anggada Realty Tbk.|298
2017-12-14|DAYA|Duta Intidaya Tbk.|196
2017-12-14|DEFI|Danasupra Erapacific Tbk|680
2017-12-14|DEWA|Darma Henwa Tbk|50
2017-12-14|DGIK|Nusa Konstruksi Enjiniring Tbk.|55
2017-12-14|DILD|Intiland Development Tbk.|374
2017-12-14|DKFT|Central Omega Resources Tbk.|398
2017-12-14|DLTA|Delta Djakarta Tbk.|4500
2017-12-14|DMAS|Puradelta Lestari Tbk.|164
2017-12-14|DNAR|Bank Dinar Indonesia Tbk.|298
2017-12-14|DNET|Indoritel Makmur Internasional Tbk.|2170
2017-12-14|DOID|Delta Dunia Makmur Tbk.|795
2017-12-14|DPNS|Duta Pertiwi Nusantara Tbk.|374
2017-12-14|DPUM|Dua Putra Utama Makmur Tbk.|280
2017-12-14|DSFI|Dharma Samudera Fishing Industries Tbk.|105
2017-12-14|DSNG|Dharma Satya Nusantara Tbk.|438
2017-12-14|DVLA|Darya-Varia Laboratoria Tbk.|1930
2017-12-14|DWGL|Dwi Guna Laksana Tbk.|316
2017-12-14|DWGL-W|Waran Seri I Dwi Guna Laksana Tbk.|1100
2017-12-14|DYAN|Dyandra Media International Tbk.|56
2017-12-14|ECII|Electronic City Indonesia Tbk.|710
2017-12-14|EKAD|Ekadharma International Tbk.|685
2017-12-14|ELSA|Elnusa Tbk.|368
2017-12-14|ELTY|Bakrieland Development Tbk.|50
2017-12-14|EMDE|Megapolitan Developments Tbk.|258
2017-12-14|EMTK|Elang Mahkota Teknologi Tbk.|9200
2017-12-14|ENRG|Energi Mega Persada Tbk.|86
2017-12-14|ERAA|Erajaya Swasembada Tbk.|760
2017-12-14|ERTX|Eratex Djaja Tbk.|123
2017-12-14|ESSA|Surya Esa Perkasa Tbk.|183
2017-12-14|ESTI|Ever Shine Tex Tbk.|83
2017-12-14|EXCL|XL Axiata Tbk.|3080
2017-12-14|FASW|Fajar Surya Wisesa Tbk.|5100
2017-12-14|FINN|First Indo American Leasing Tbk.|130
2017-12-14|FIRE|Alfa Energi Investama Tbk.|1170
2017-12-14|FIRE-W|Waran Seri I Alfa Energi Investama Tbk.|498
2017-12-14|FMII|Fortune Mate Indonesia Tbk|480
2017-12-14|FORZ|Forza Land Indonesia Tbk.|765
2017-12-14|FPNI|Lotte Chemical Titan Tbk.|158
2017-12-14|FREN|Smartfren Telecom Tbk.|50
2017-12-14|GDST|Gunawan Dianjaya Steel Tbk.|81
2017-12-14|GEMA|Gema Grahasarana Tbk.|960
2017-12-14|GGRM|Gudang Garam Tbk.|79275
2017-12-14|GIAA|Garuda Indonesia (Persero) Tbk.|304
2017-12-14|GJTL|Gajah Tunggal Tbk.|685
2017-12-14|GMFI|Garuda Maintenance Facility Aero Asia Tb|310
2017-12-14|GMTD|Gowa Makassar Tourism Development Tbk.|10250
2017-12-14|GOLD|Visi Telekomunikasi Infrastruktur Tbk.|500
2017-12-14|GOLL|Golden Plantation Tbk.|98
2017-12-14|GOLL-W|Waran Seri I Golden Plantation Tbk.|2
2017-12-14|GPRA|Perdana Gapuraprima Tbk.|110
2017-12-14|GSMF|Equity Development Investment Tbk.|120
2017-12-14|GTBO|Garda Tujuh Buana Tbk|185
2017-12-14|GWSA|Greenwood Sejahtera Tbk.|158
2017-12-14|GZCO|Gozco Plantations Tbk.|61
2017-12-14|HDFA|Radana Bhaskara Finance Tbk.|214
2017-12-14|HERO|Hero Supermarket Tbk.|880
2017-12-14|HEXA|Hexindo Adiperkasa Tbk.|2780
2017-12-14|HITS|Humpuss Intermoda Transportasi Tbk.|700
2017-12-14|HMSP|H.M. Sampoerna Tbk.|4370
2017-12-14|HOKI|Buyung Poetra Sembada Tbk.|336
2017-12-14|HOKI-W|Waran Seri I Buyung Poetra Sembada Tbk.|71
2017-12-14|HOME|Hotel Mandarine Regency Tbk.|79
2017-12-14|HOTL|Saraswati Griya Lestari Tbk.|104
2017-12-14|HOTL-W|Waran Seri I Saraswati Griya Lestari Tbk|4
2017-12-14|HRTA|Hartadinata Abadi Tbk.|298
2017-12-14|HRUM|Harum Energy Tbk.|2080
2017-12-14|IBFN|Intan Baruprana Finance Tbk.|184
2017-12-14|ICBP|Indofood CBP Sukses Makmur Tbk.|8850
2017-12-14|ICON|Island Concepts Indonesia Tbk.|111
2017-12-14|IDPR|Indonesia Pondasi Raya Tbk.|990
2017-12-14|IGAR|Champion Pacific Indonesia Tbk.|390
2017-12-14|IIKP|Inti Agri Resources Tbk|302
2017-12-14|IMAS|Indomobil Sukses Internasional Tbk.|850
2017-12-14|IMJS|Indomobil Multi Jasa Tbk.|284
2017-12-14|IMPC|Impack Pratama Industri Tbk.|1055
2017-12-14|INAF|Indofarma Tbk.|3930
2017-12-14|INAI|Indal Aluminium Industry Tbk.|356
2017-12-14|INCF|Indo Komoditi Korpora Tbk.|248
2017-12-14|INCI|Intanwijaya Internasional Tbk|402
2017-12-14|INCO|Vale Indonesia Tbk.|2880
2017-12-14|INDF|Indofood Sukses Makmur Tbk.|7475
2017-12-14|INDR|Indo-Rama Synthetics Tbk.|1300
2017-12-14|INDS|Indospring Tbk.|1245
2017-12-14|INDX|Tanah Laut Tbk|91
2017-12-14|INDY|Indika Energy Tbk.|3160
2017-12-14|INKP|Indah Kiat Pulp & Paper Tbk.|5075
2017-12-14|INPC|Bank Artha Graha Internasional Tbk.|81
2017-12-14|INPC-W|Waran Seri I Bank Artha Graha Internasio|16
2017-12-14|INPP|Indonesian Paradise Property Tbk.|670
2017-12-14|INRU|Toba Pulp Lestari Tbk.|300
2017-12-14|INTA|Intraco Penta Tbk.|408
2017-12-14|INTA-W|Waran Seri I Intraco Penta Tbk.|152
2017-12-14|INTD|Inter Delta Tbk|400
2017-12-14|INTP|Indocement Tunggal Prakarsa Tbk.|19650
2017-12-14|IPOL|Indopoly Swakarsa Industry Tbk.|116
2017-12-14|ISAT|Indosat Tbk.|5000
2017-12-14|ISSP|Steel Pipe Industry of Indonesia Tbk.|128
2017-12-14|ITMA|Sumber Energi Andalan Tbk.|590
2017-12-14|ITMG|Indo Tambangraya Megah Tbk.|21000
2017-12-14|JAWA|Jaya Agra Wattie Tbk.|192
2017-12-14|JECC|Jembo Cable Company Tbk.|4700
2017-12-14|JGLE|Graha Andrasentra Propertindo Tbk.|90
2017-12-14|JIHD|Jakarta International Hotels & Developme|494
2017-12-14|JKON|Jaya Konstruksi Manggala Pratama Tbk.|410
2017-12-14|JPFA|Japfa Comfeed Indonesia Tbk.|1265
2017-12-14|JPRS|Jaya Pari Steel Tbk|128
2017-12-14|JRPT|Jaya Real Property Tbk.|840
2017-12-14|JSMR|Jasa Marga (Persero) Tbk.|6300
2017-12-14|JTPE|Jasuindo Tiga Perkasa Tbk.|304
2017-12-14|KAEF|Kimia Farma Tbk.|2600
2017-12-14|KARW|ICTSI Jasa Prima Tbk.|92
2017-12-14|KBLI|KMI Wire & Cable Tbk.|432
2017-12-14|KBLM|Kabelindo Murni Tbk.|262
2017-12-14|KICI|Kedaung Indah Can Tbk|161
2017-12-14|KIJA|Kawasan Industri Jababeka Tbk.|290
2017-12-14|KINO|Kino Indonesia Tbk.|2000
2017-12-14|KIOS|Kioson Komersial Indonesia Tbk.|2970
2017-12-14|KIOS-W|Waran Seri I Kioson Komersial Indonesia|1940
2017-12-14|KKGI|Resource Alam Indonesia Tbk.|314
2017-12-14|KLBF|Kalbe Farma Tbk.|1660
2017-12-14|KMTR|Kirana Megatara Tbk.|480
2017-12-14|KOBX|Kobexindo Tractors Tbk.|103
2017-12-14|KONI|Perdana Bangun Pusaka Tbk|244
2017-12-14|KOPI|Mitra Energi Persada Tbk.|745
2017-12-14|KPIG|MNC Land Tbk.|1080
2017-12-14|KRAH|Grand Kartech Tbk.|2730
2017-12-14|KRAS|Krakatau Steel (Persero) Tbk.|390
2017-12-14|KREN|Kresna Graha Investama Tbk.|500
2017-12-14|LCGP|Eureka Prima Jakarta Tbk.|70
2017-12-14|LEAD|Logindo Samudramakmur Tbk.|71
2017-12-14|LINK|Link Net Tbk.|5300
2017-12-14|LION|Lion Metal Works Tbk.|695
2017-12-14|LMAS|Limas Indonesia Makmur Tbk|64
2017-12-14|LMPI|Langgeng Makmur Industri Tbk.|171
2017-12-14|LMSH|Lionmesh Prima Tbk.|630
2017-12-14|LPCK|Lippo Cikarang Tbk|3390
2017-12-14|LPGI|Lippo General Insurance Tbk.|4860
2017-12-14|LPIN|Multi Prima Sejahtera Tbk|1350
2017-12-14|LPKR|Lippo Karawaci Tbk.|540
2017-12-14|LPLI|Star Pacific Tbk|140
2017-12-14|LPPF|Matahari Department Store Tbk.|10250
2017-12-14|LPPS|Lippo Securities Tbk.|89
2017-12-14|LRNA|Eka Sari Lorena Transport Tbk.|93
2017-12-14|LRNA-W|Waran Seri I Eka Sari Lorena Transport T|17
2017-12-14|LSIP|PP London Sumatra Indonesia Tbk.|1240
2017-12-14|LTLS|Lautan Luas Tbk.|480
2017-12-14|MABA|Marga Abhinaya Abadi Tbk.|1900
2017-12-14|MAIN|Malindo Feedmill Tbk.|775
2017-12-14|MAMI|Mas Murni Indonesia Tbk|96
2017-12-14|MAPB|MAP Boga Adiperkasa Tbk.|1945
2017-12-14|MAPI|Mitra Adiperkasa Tbk.|6550
2017-12-14|MARI|Mahaka Radio Integra Tbk.|1050
2017-12-14|MARK|Mark Dynamics Indonesia Tbk.|1590
2017-12-14|MASA|Multistrada Arah Sarana Tbk.|288
2017-12-14|MAYA|Bank Mayapada Internasional Tbk.|4190
2017-12-14|MBAP|Mitrabara Adiperdana Tbk.|3000
2017-12-14|MBSS|Mitrabahtera Segara Sejati Tbk.|645
2017-12-14|MBTO|Martina Berto Tbk.|98
2017-12-14|MCAS|M Cash Integrasi Tbk.|2100
2017-12-14|MCOR|Bank China Construction Bank Indonesia T|208
2017-12-14|MDIA|Intermedia Capital Tbk.|178
2017-12-14|MDKA|Merdeka Copper Gold Tbk.|2290
2017-12-14|MDKI|Emdeki Utama Tbk.|272
2017-12-14|MDLN|Modernland Realty Tbk.|300
2017-12-14|MDRN|Modern Internasional Tbk.|50
2017-12-14|MEDC|Medco Energi Internasional Tbk.|880
2017-12-14|MEGA|Bank Mega Tbk.|2850
2017-12-14|META|Nusantara Infrastructure Tbk.|220
2017-12-14|MFIN|Mandala Multifinance Tbk.|1440
2017-12-14|MFMI|Multifiling Mitra Indonesia Tbk.|720
2017-12-14|MGNA|Magna Investama Mandiri Tbk.|84
2017-12-14|MICE|Multi Indocitra Tbk.|360
2017-12-14|MIDI|Midi Utama Indonesia Tbk.|980
2017-12-14|MIKA|Mitra Keluarga Karyasehat Tbk.|1740
2017-12-14|MIRA|Mitra International Resources Tbk.|50
2017-12-14|MITI|Mitra Investindo Tbk.|50
2017-12-14|MKNT|Mitra Komunikasi Nusantara Tbk.|254
2017-12-14|MKPI|Metropolitan Kentjana Tbk.|36000
2017-12-14|MLBI|Multi Bintang Indonesia Tbk.|13700
2017-12-14|MLPL|Multipolar Tbk.|144
2017-12-14|MLPT|Multipolar Technology Tbk.|850
2017-12-14|MPMX|Mitra Pinasthika Mustika Tbk.|970
2017-12-14|MPOW|Megapower Makmur Tbk.|298
2017-12-14|MPPA|Matahari Putra Prima Tbk.|424
2017-12-14|MREI|Maskapai Reasuransi Indonesia Tbk.|4140
2017-12-14|MSKY|MNC Sky Vision Tbk.|935
2017-12-14|MTDL|Metrodata Electronics Tbk.|605
2017-12-14|MTRA|Mitra Pemuda Tbk.|256
2017-12-14|MTWI|Malacca Trust Wuwungan Insurance Tbk.|146
2017-12-14|MYOH|Samindo Resources Tbk.|670
2017-12-14|MYOR|Mayora Indah Tbk.|2180
2017-12-14|MYRX|Hanson International Tbk.|110
2017-12-14|MYRXP|Saham Seri B Hanson International Tbk.|50
2017-12-14|NAGA|Bank Mitraniaga Tbk.|204
2017-12-14|NASA-W|Waran Seri I Ayana Land International Tb|256
2017-12-14|NELY|Pelayaran Nelly Dwi Putri Tbk.|121
2017-12-14|NIKL|Pelat Timah Nusantara Tbk.|3760
2017-12-14|NIPS|Nipress Tbk.|370
2017-12-14|NIRO|Nirvana Development Tbk.|56
2017-12-14|NOBU|Bank Nationalnobu Tbk.|935
2017-12-14|NRCA|Nusa Raya Cipta Tbk.|378
2017-12-14|OASA|Protech Mitra Perkasa Tbk.|388
2017-12-14|OKAS|Ancora Indonesia Resources Tbk.|364
2017-12-14|PADI|Minna Padi Investama Sekuritas Tbk.|1030
2017-12-14|PANR|Panorama Sentrawisata Tbk.|535
2017-12-14|PANS|Panin Sekuritas Tbk.|2020
2017-12-14|PBID|Panca Budi Idaman Tbk.|880
2017-12-14|PBRX|Pan Brothers Tbk.|496
2017-12-14|PEGE|Panca Global Securities Tbk.|300
2017-12-14|PGAS|Perusahaan Gas Negara (Persero) Tbk.|1715
2017-12-14|PGLI|Pembangunan Graha Lestari Indah Tbk.|156
2017-12-14|PICO|Pelangi Indah Canindo Tbk|228
2017-12-14|PJAA|Pembangunan Jaya Ancol Tbk.|1340
2017-12-14|PKPK|Perdana Karya Perkasa Tbk|69
2017-12-14|PLIN|Plaza Indonesia Realty Tbk.|3500
2017-12-14|PNBN|Bank Pan Indonesia Tbk|1155
2017-12-14|PNBS|Bank Panin Dubai Syariah Tbk.|65
2017-12-14|PNIN|Paninvest Tbk.|880
2017-12-14|PNLF|Panin Financial Tbk.|236
2017-12-14|POLY|Asia Pacific Fibers Tbk|70
2017-12-14|POOL|Pool Advista Indonesia Tbk.|3810
2017-12-14|POWR|Cikarang Listrindo Tbk.|1315
2017-12-14|PPRE|PP Presisi Tbk.|332
2017-12-14|PPRO|PP Properti Tbk.|186
2017-12-14|PRAS|Prima Alloy Steel Universal Tbk.|204
2017-12-14|PRDA|Prodia Widyahusada Tbk.|3790
2017-12-14|PSAB|J Resources Asia Pasifik Tbk.|157
2017-12-14|PSDN|Prasidha Aneka Niaga Tbk|270
2017-12-14|PSSI|Pelita Samudera Shipping Tbk.|116
2017-12-14|PTBA|Bukit Asam Tbk.|2260
2017-12-14|PTIS|Indo Straits Tbk.|600
2017-12-14|PTPP|PP (Persero) Tbk.|2510
2017-12-14|PTRO|Petrosea Tbk.|1800
2017-12-14|PTSN|Sat Nusapersada Tbk|195
2017-12-14|PUDP|Pudjiadi Prestige Tbk.|478
2017-12-14|PWON|Pakuwon Jati Tbk.|650
2017-12-14|RAJA|Rukun Raharja Tbk.|268
2017-12-14|RALS|Ramayana Lestari Sentosa Tbk.|1060
2017-12-14|RBMS|Ristia Bintang Mahkotasejati Tbk.|318
2017-12-14|RDTX|Roda Vivatex Tbk|6000
2017-12-14|RELI|Reliance Sekuritas Indonesia Tbk.|374
2017-12-14|RICY|Ricky Putra Globalindo Tbk|151
2017-12-14|RIGS|Rig Tenders Indonesia Tbk.|170
2017-12-14|RIMO|Rimo International Lestari Tbk|154
2017-12-14|RODA|Pikko Land Development Tbk.|151
2017-12-14|ROTI|Nippon Indosari Corpindo Tbk.|1270
2017-12-14|SAME|Sarana Meditama Metropolitan Tbk.|545
2017-12-14|SCCO|Supreme Cable Manufacturing & Commerce T|8850
2017-12-14|SCMA|Surya Citra Media Tbk.|2430
2017-12-14|SDMU|Sidomulyo Selaras Tbk.|302
2017-12-14|SDPC|Millennium Pharmacon International Tbk.|111
2017-12-14|SGRO|Sampoerna Agro Tbk.|2550
2017-12-14|SHIP|Sillo Maritime Perdana Tbk.|790
2017-12-14|SIDO|Industri Jamu dan Farmasi Sido Muncul Tb|545
2017-12-14|SILO|Siloam International Hospitals Tbk.|10575
2017-12-14|SIMA|Siwani Makmur Tbk|212
2017-12-14|SIMP|Salim Ivomas Pratama Tbk.|468
2017-12-14|SIPD|Sierad Produce Tbk.|795
2017-12-14|SMAR|Smart Tbk.|3600
2017-12-14|SMBR|Semen Baturaja (Persero) Tbk.|2850
2017-12-14|SMCB|Holcim Indonesia Tbk.|805
2017-12-14|SMDM|Suryamas Dutamakmur Tbk.|106
2017-12-14|SMDR|Samudera Indonesia  Tbk.|418
2017-12-14|SMGR|Semen Indonesia (Persero) Tbk.|9775
2017-12-14|SMMT|Golden Eagle Energy Tbk.|132
2017-12-14|SMRA|Summarecon Agung Tbk.|845
2017-12-14|SMRU|SMR Utama Tbk.|498
2017-12-14|SMSM|Selamat Sempurna Tbk.|1295
2017-12-14|SOCI|Soechi Lines Tbk.|244
2017-12-14|SONA|Sona Topas Tourism Industry Tbk.|2300
2017-12-14|SPMA|Suparma Tbk.|232
2017-12-14|SRIL|Sri Rejeki Isman Tbk.|372
2017-12-14|SRSN|Indo Acidatama Tbk|50
2017-12-14|SRTG|Saratoga Investama Sedaya Tbk.|3590
2017-12-14|SSIA|Surya Semesta Internusa Tbk.|470
2017-12-14|SSMS|Sawit Sumbermas Sarana Tbk.|1470
2017-12-14|STAR|Star  Petrochem Tbk.|57
2017-12-14|SUGI|Sugih Energy Tbk.|50
2017-12-14|SULI|SLJ Global Tbk.|166
2017-12-14|TAMU|Pelayaran Tamarin Samudra Tbk.|2630
2017-12-14|TARA|Sitara Propertindo Tbk.|740
2017-12-14|TAXI|Express Transindo Utama Tbk.|50
2017-12-14|TBIG|Tower Bersama Infrastructure Tbk.|6150
2017-12-14|TBLA|Tunas Baru Lampung Tbk.|1290
2017-12-14|TBMS|Tembaga Mulia Semanan Tbk.|900
2017-12-14|TELE|Tiphone Mobile Indonesia Tbk.|1010
2017-12-14|TGKA|Tigaraksa Satria Tbk.|2600
2017-12-14|TGRA|Terregra Asia Energy Tbk.|515
2017-12-14|TIFA|Tifa Finance Tbk.|189
2017-12-14|TINS|Timah (Persero) Tbk.|765
2017-12-14|TIRT|Tirta Mahakam Resources Tbk|90
2017-12-14|TKIM|Pabrik Kertas Tjiwi Kimia Tbk.|2940
2017-12-14|TLKM|Telekomunikasi Indonesia (Persero) Tbk.|4220
2017-12-14|TMAS|Pelayaran Tempuran Emas Tbk.|1160
2017-12-14|TMPO|Tempo Intimedia Tbk.|280
2017-12-14|TOBA|Toba Bara Sejahtra Tbk.|2100
2017-12-14|TOPS|Totalindo Eka Persada Tbk.|3220
2017-12-14|TOTL|Total Bangun Persada Tbk.|660
2017-12-14|TOTO|Surya Toto Indonesia Tbk.|404
2017-12-14|TOWR|Sarana Menara Nusantara Tbk.|3890
2017-12-14|TPIA|Chandra Asri Petrochemical Tbk.|5700
2017-12-14|TPMA|Trans Power Marine Tbk.|175
2017-12-14|TRAM|Trada Alam Minera Tbk.|149
2017-12-14|TRIM|Trimegah Sekuritas Indonesia Tbk.|143
2017-12-14|TRIS|Trisula International Tbk.|300
2017-12-14|TRUS|Trust Finance Indonesia Tbk|158
2017-12-14|TSPC|Tempo Scan Pacific Tbk.|1700
2017-12-14|TURI|Tunas Ridean Tbk.|1135
2017-12-14|ULTJ|Ultra Jaya Milk Industry & Trading Compa|1310
2017-12-14|UNIC|Unggul Indah Cahaya Tbk.|3700
2017-12-14|UNIT|Nusantara Inti Corpora Tbk|200
2017-12-14|UNSP|Bakrie Sumatera Plantations Tbk.|169
2017-12-14|UNTR|United Tractors Tbk.|33250
2017-12-14|UNVR|Unilever Indonesia Tbk.|51000
2017-12-14|VICO|Victoria Investama Tbk.|236
2017-12-14|VINS|Victoria Insurance Tbk.|187
2017-12-14|VINS-W|Waran Seri I Victoria Insurance Tbk.|74
2017-12-14|VIVA|Visi Media Asia Tbk.|304
2017-12-14|VOKS|Voksel Electric Tbk.|262
2017-12-14|VRNA|Verena Multi Finance Tbk.|98
2017-12-14|WAPO|Wahana Pronatural Tbk.|79
2017-12-14|WEGE|Wijaya Karya Bangunan Gedung Tbk.|260
2017-12-14|WEHA|WEHA Transportasi Indonesia Tbk.|199
2017-12-14|WICO|Wicaksana Overseas International Tbk.|645
2017-12-14|WIIM|Wismilak Inti Makmur Tbk.|280
2017-12-14|WIKA|Wijaya Karya (Persero) Tbk.|1520
2017-12-14|WINS|Wintermar Offshore Marine Tbk.|330
2017-12-14|WOMF|Wahana Ottomitra Multiartha Tbk.|199
2017-12-14|WOOD|Integra Indocabinet Tbk.|230
2017-12-14|WSBP|Waskita Beton Precast Tbk.|366
2017-12-14|WSKT|Waskita Karya (Persero) Tbk.|1920
2017-12-14|WTON|Wijaya Karya Beton Tbk.|474
2017-12-14|XCID|DIRE Ciptadana Properti Ritel Indonesia|96
2017-12-14|XIIF|Reksa Dana Premier ETF Indonesia Financi|706
2017-12-14|XIIT|Reksa Dana Premier ETF IDX30|573
2017-12-14|XISR|Premier ETF SRI-KEHATI|378
2017-12-14|YPAS|Yanaprima Hastapersada Tbk|970
2017-12-14|YULE|Yulie Sekuritas Indonesia Tbk.|200
2017-12-14|ZINC|Kapuas Prima Coal Tbk.|1315
