2017-11-27|AALI|Astra Agro Lestari Tbk.|14325
2017-11-27|ABBA|Mahaka Media Tbk.|50
2017-11-27|ABMM|ABM Investama Tbk.|2000
2017-11-27|ACES|Ace Hardware Indonesia Tbk.|1130
2017-11-27|ACST|Acset Indonusa Tbk.|2830
2017-11-27|ADES|Akasha Wira International Tbk.|975
2017-11-27|ADHI|Adhi Karya (Persero) Tbk.|2030
2017-11-27|ADMF|Adira Dinamika Multi Finance Tbk.|7175
2017-11-27|ADMG|Polychem Indonesia Tbk|284
2017-11-27|ADRO|Adaro Energy Tbk.|1720
2017-11-27|AGII|Aneka Gas Industri Tbk.|615
2017-11-27|AGRO|Bank Rakyat Indonesia Agroniaga Tbk.|540
2017-11-27|AGRO-W|Waran Seri II Bank Rakyat Indonesia Agro|410
2017-11-27|AGRS|Bank Agris Tbk.|250
2017-11-27|AHAP|Asuransi Harta Aman Pratama Tbk.|166
2017-11-27|AIMS|Akbar Indo Makmur Stimec Tbk|240
2017-11-27|AISA|Tiga Pilar Sejahtera Food Tbk.|760
2017-11-27|AKKU|Anugerah Kagum Karya Utama Tbk.|57
2017-11-27|AKPI|Argha Karya Prima Industry Tbk.|700
2017-11-27|AKRA|AKR Corporindo Tbk.|6700
2017-11-27|AKSI|Majapahit Inti Corpora Tbk.|310
2017-11-27|ALKA|Alakasa Industrindo Tbk|410
2017-11-27|ALMI|Alumindo Light Metal Industry Tbk.|226
2017-11-27|ALTO|Tri Banyan Tirta Tbk.|565
2017-11-27|AMAG|Asuransi Multi Artha Guna Tbk.|360
2017-11-27|AMFG|Asahimas Flat Glass Tbk.|6400
2017-11-27|AMIN|Ateliers Mecaniques D Indonesie Tbk.|400
2017-11-27|AMRT|Sumber Alfaria Trijaya Tbk.|700
2017-11-27|ANJT|Austindo Nusantara Jaya Tbk.|1160
2017-11-27|ANTM|Aneka Tambang (Persero) Tbk.|660
2017-11-27|APEX|Apexindo Pratama Duta Tbk.|1780
2017-11-27|APIC|Pacific Strategic Financial Tbk.|450
2017-11-27|APIC-W|Waran Seri II Pacific Strategic Financia|595
2017-11-27|APII|Arita Prima Indonesia Tbk.|230
2017-11-27|APLI|Asiaplast Industries Tbk.|77
2017-11-27|APLN|Agung Podomoro Land Tbk.|244
2017-11-27|ARII|Atlas Resources Tbk.|755
2017-11-27|ARMY|Armidian Karyatama Tbk.|206
2017-11-27|ARNA|Arwana Citramulia Tbk.|352
2017-11-27|ARTA|Arthavest Tbk|248
2017-11-27|ARTI|Ratu Prabu Energi Tbk|50
2017-11-27|ARTO|Bank Artos Indonesia Tbk.|158
2017-11-27|ASBI|Asuransi Bintang Tbk.|298
2017-11-27|ASGR|Astra Graphia Tbk.|1350
2017-11-27|ASII|Astra International Tbk.|8475
2017-11-27|ASJT|Asuransi Jasa Tania Tbk.|530
2017-11-27|ASMI|Asuransi Kresna Mitra Tbk.|860
2017-11-27|ASRI|Alam Sutera Realty Tbk.|384
2017-11-27|ASRM|Asuransi Ramayana Tbk.|1850
2017-11-27|ASSA|Adi Sarana Armada Tbk.|214
2017-11-27|ATIC|Anabatic Technologies Tbk.|775
2017-11-27|AUTO|Astra Otoparts Tbk.|2230
2017-11-27|BABP|Bank MNC Internasional Tbk.|50
2017-11-27|BACA|Bank Capital Indonesia Tbk.|212
2017-11-27|BACA-W|Waran Seri II Bank Capital Indonesia Tbk|100
2017-11-27|BAJA|Saranacentral Bajatama Tbk.|175
2017-11-27|BALI|Bali Towerindo Sentra Tbk.|1295
2017-11-27|BAPA|Bekasi Asri Pemula Tbk.|100
2017-11-27|BATA|Sepatu Bata Tbk.|540
2017-11-27|BBCA|Bank Central Asia Tbk.|20825
2017-11-27|BBHI|Bank Harda Internasional Tbk.|127
2017-11-27|BBKP|Bank Bukopin Tbk.|575
2017-11-27|BBLD|Buana Finance Tbk.|520
2017-11-27|BBNI|Bank Negara Indonesia (Persero) Tbk.|8275
2017-11-27|BBRI|Bank Rakyat Indonesia (Persero) Tbk.|3310
2017-11-27|BBRM|Pelayaran Nasional Bina Buana Raya Tbk.|50
2017-11-27|BBTN|Bank Tabungan Negara (Persero) Tbk.|3090
2017-11-27|BBYB|Bank Yudha Bhakti Tbk.|306
2017-11-27|BCIP|Bumi Citra Permai Tbk.|179
2017-11-27|BDMN|Bank Danamon Indonesia Tbk.|5475
2017-11-27|BEKS|Bank Pembangunan Daerah Banten Tbk.|50
2017-11-27|BELL|Trisula Textile Industries Tbk.|200
2017-11-27|BEST|Bekasi Fajar Industrial Estate Tbk.|274
2017-11-27|BFIN|BFI Finance  Indonesia Tbk.|690
2017-11-27|BGTG|Bank Ganesha Tbk.|94
2017-11-27|BHIT|MNC Investama Tbk.|96
2017-11-27|BIKA|Binakarya Jaya Abadi Tbk.|300
2017-11-27|BIMA|Primarindo Asia Infrastructure Tbk.|79
2017-11-27|BINA|Bank Ina Perdana Tbk.|930
2017-11-27|BIPI|Benakat Integra Tbk.|85
2017-11-27|BIPP|Bhuwanatala Indah Permai Tbk.|77
2017-11-27|BIPP-W|Waran Seri III Bhuwanatala Indah Permai|10
2017-11-27|BIRD|Blue Bird Tbk.|3920
2017-11-27|BISI|BISI International Tbk.|1690
2017-11-27|BJBR|Bank Pembangunan Daerah Jawa Barat dan B|2420
2017-11-27|BJTM|Bank Pembangunan Daerah Jawa Timur Tbk.|710
2017-11-27|BKDP|Bukit Darmo Property Tbk|78
2017-11-27|BKSL|Sentul City Tbk.|153
2017-11-27|BKSL-W|Waran Seri I Sentul City Tbk.|59
2017-11-27|BKSW|Bank QNB Indonesia Tbk.|210
2017-11-27|BLTZ|Graha Layar Prima Tbk.|10000
2017-11-27|BMAS|Bank Maspion Indonesia Tbk.|340
2017-11-27|BMRI|Bank Mandiri (Persero) Tbk.|7450
2017-11-27|BMSR|Bintang Mitra Semestaraya Tbk|120
2017-11-27|BMTR|Global Mediacom Tbk.|590
2017-11-27|BNBA|Bank Bumi Arta Tbk.|262
2017-11-27|BNBR|Bakrie & Brothers Tbk|50
2017-11-27|BNGA|Bank CIMB Niaga Tbk.|1170
2017-11-27|BNII|Bank Maybank Indonesia Tbk.|298
2017-11-27|BNLI|Bank Permata Tbk.|630
2017-11-27|BOGA|Bintang Oto Global Tbk.|610
2017-11-27|BOLT|Garuda Metalindo Tbk.|920
2017-11-27|BPFI|Batavia Prosperindo Finance Tbk.|460
2017-11-27|BRMS|Bumi Resources Minerals Tbk.|73
2017-11-27|BRPT|Barito Pacific Tbk.|2220
2017-11-27|BSDE|Bumi Serpong Damai Tbk.|1685
2017-11-27|BSIM|Bank Sinarmas Tbk.|885
2017-11-27|BSSR|Baramulti Suksessarana Tbk.|2510
2017-11-27|BSWD|Bank Of India Indonesia Tbk.|1800
2017-11-27|BTEK|Bumi Teknokultura Unggul Tbk|114
2017-11-27|BTEL|Bakrie Telecom Tbk.|50
2017-11-27|BTON|Betonjaya Manunggal Tbk.|117
2017-11-27|BTPN|Bank Tabungan Pensiunan Nasional Tbk.|2400
2017-11-27|BUDI|Budi Starch & Sweetener Tbk.|97
2017-11-27|BUKK|Bukaka Teknik Utama Tbk.|1550
2017-11-27|BULL|Buana Listya Tama Tbk.|160
2017-11-27|BULL-W|Waran Seri II Buana Listya Tama Tbk.|80
2017-11-27|BUMI|Bumi Resources Tbk.|302
2017-11-27|BUVA|Bukit Uluwatu Villa Tbk.|525
2017-11-27|BVIC|Bank Victoria International Tbk.|254
2017-11-27|BWPT|Eagle High Plantations Tbk.|228
2017-11-27|BYAN|Bayan Resources Tbk.|10800
2017-11-27|CANI|Capitol Nusantara Indonesia Tbk.|300
2017-11-27|CARS|Industri dan Perdagangan Bintraco Dharma|975
2017-11-27|CASA|Capital Financial Indonesia Tbk.|402
2017-11-27|CASS|Cardig Aero Services Tbk.|770
2017-11-27|CEKA|Wilmar Cahaya Indonesia Tbk.|1305
2017-11-27|CENT|Centratama Telekomunikasi Indonesia Tbk.|90
2017-11-27|CFIN|Clipan Finance Indonesia Tbk.|302
2017-11-27|CINT|Chitose Internasional Tbk.|336
2017-11-27|CKRA|Cakra Mineral Tbk.|78
2017-11-27|CLEO|Sariguna Primatirta Tbk.|925
2017-11-27|CLPI|Colorpak Indonesia Tbk.|890
2017-11-27|CMNP|Citra Marga Nusaphala Persada Tbk.|1510
2017-11-27|CMPP|Rimau Multi Putra Pratama Tbk.|288
2017-11-27|CNKO|Exploitasi Energi Indonesia Tbk.|50
2017-11-27|CNTX|Century Textile Industry Tbk.|484
2017-11-27|COWL|Cowell Development Tbk.|905
2017-11-27|CPIN|Charoen Pokphand Indonesia Tbk|3040
2017-11-27|CPRO|Central Proteina Prima Tbk.|50
2017-11-27|CSAP|Catur Sentosa Adiprana Tbk.|450
2017-11-27|CTRA|Ciputra Development Tbk.|1200
2017-11-27|CTTH|Citatah Tbk.|71
2017-11-27|DART|Duta Anggada Realty Tbk.|306
2017-11-27|DAYA|Duta Intidaya Tbk.|190
2017-11-27|DEFI|Danasupra Erapacific Tbk|695
2017-11-27|DEWA|Darma Henwa Tbk|50
2017-11-27|DGIK|Nusa Konstruksi Enjiniring Tbk.|67
2017-11-27|DILD|Intiland Development Tbk.|382
2017-11-27|DKFT|Central Omega Resources Tbk.|408
2017-11-27|DLTA|Delta Djakarta Tbk.|4500
2017-11-27|DMAS|Puradelta Lestari Tbk.|175
2017-11-27|DNAR|Bank Dinar Indonesia Tbk.|272
2017-11-27|DNET|Indoritel Makmur Internasional Tbk.|2150
2017-11-27|DOID|Delta Dunia Makmur Tbk.|800
2017-11-27|DPUM|Dua Putra Utama Makmur Tbk.|286
2017-11-27|DSFI|Dharma Samudera Fishing Industries Tbk.|116
2017-11-27|DSNG|Dharma Satya Nusantara Tbk.|472
2017-11-27|DVLA|Darya-Varia Laboratoria Tbk.|1980
2017-11-27|DYAN|Dyandra Media International Tbk.|57
2017-11-27|ECII|Electronic City Indonesia Tbk.|670
2017-11-27|EKAD|Ekadharma International Tbk.|705
2017-11-27|ELSA|Elnusa Tbk.|412
2017-11-27|ELTY|Bakrieland Development Tbk.|50
2017-11-27|EMDE|Megapolitan Developments Tbk.|286
2017-11-27|EMTK|Elang Mahkota Teknologi Tbk.|9800
2017-11-27|ENRG|Energi Mega Persada Tbk.|103
2017-11-27|ERAA|Erajaya Swasembada Tbk.|745
2017-11-27|ERTX|Eratex Djaja Tbk.|136
2017-11-27|ESSA|Surya Esa Perkasa Tbk.|210
2017-11-27|ESTI|Ever Shine Tex Tbk.|78
2017-11-27|EXCL|XL Axiata Tbk.|3010
2017-11-27|FAST|Fast Food Indonesia Tbk.|1540
2017-11-27|FASW|Fajar Surya Wisesa Tbk.|5500
2017-11-27|FINN|First Indo American Leasing Tbk.|193
2017-11-27|FIRE|Alfa Energi Investama Tbk.|1540
2017-11-27|FIRE-W|Waran Seri I Alfa Energi Investama Tbk.|640
2017-11-27|FMII|Fortune Mate Indonesia Tbk|550
2017-11-27|FORU|Fortune Indonesia Tbk|188
2017-11-27|FORZ|Forza Land Indonesia Tbk.|770
2017-11-27|FORZ-W|Waran Seri I Forza Land Indonesia Tbk.|476
2017-11-27|FPNI|Lotte Chemical Titan Tbk.|194
2017-11-27|FREN|Smartfren Telecom Tbk.|50
2017-11-27|GAMA|Gading Development Tbk.|50
2017-11-27|GDST|Gunawan Dianjaya Steel Tbk.|86
2017-11-27|GGRM|Gudang Garam Tbk.|79500
2017-11-27|GIAA|Garuda Indonesia (Persero) Tbk.|330
2017-11-27|GJTL|Gajah Tunggal Tbk.|755
2017-11-27|GMFI|Garuda Maintenance Facility Aero Asia Tb|350
2017-11-27|GOLD|Visi Telekomunikasi Infrastruktur Tbk.|450
2017-11-27|GOLL|Golden Plantation Tbk.|109
2017-11-27|GOLL-W|Waran Seri I Golden Plantation Tbk.|11
2017-11-27|GPRA|Perdana Gapuraprima Tbk.|118
2017-11-27|GSMF|Equity Development Investment Tbk.|119
2017-11-27|GWSA|Greenwood Sejahtera Tbk.|148
2017-11-27|GZCO|Gozco Plantations Tbk.|68
2017-11-27|HDFA|Radana Bhaskara Finance Tbk.|202
2017-11-27|HEXA|Hexindo Adiperkasa Tbk.|3450
2017-11-27|HITS|Humpuss Intermoda Transportasi Tbk.|705
2017-11-27|HMSP|H.M. Sampoerna Tbk.|4160
2017-11-27|HOKI|Buyung Poetra Sembada Tbk.|382
2017-11-27|HOKI-W|Waran Seri I Buyung Poetra Sembada Tbk.|87
2017-11-27|HOME|Hotel Mandarine Regency Tbk.|102
2017-11-27|HOTL|Saraswati Griya Lestari Tbk.|111
2017-11-27|HOTL-W|Waran Seri I Saraswati Griya Lestari Tbk|8
2017-11-27|HRTA|Hartadinata Abadi Tbk.|286
2017-11-27|HRUM|Harum Energy Tbk.|2100
2017-11-27|IATA|Indonesia Transport & Infrastructure Tbk|50
2017-11-27|IBST|Inti Bangun Sejahtera Tbk.|9600
2017-11-27|ICBP|Indofood CBP Sukses Makmur Tbk.|8650
2017-11-27|ICON|Island Concepts Indonesia Tbk.|121
2017-11-27|IDPR|Indonesia Pondasi Raya Tbk.|1000
2017-11-27|IGAR|Champion Pacific Indonesia Tbk.|420
2017-11-27|IIKP|Inti Agri Resources Tbk|306
2017-11-27|IKBI|Sumi Indo Kabel Tbk.|306
2017-11-27|IMAS|Indomobil Sukses Internasional Tbk.|950
2017-11-27|IMJS|Indomobil Multi Jasa Tbk.|278
2017-11-27|IMPC|Impack Pratama Industri Tbk.|1035
2017-11-27|INAF|Indofarma Tbk.|2480
2017-11-27|INAI|Indal Aluminium Industry Tbk.|360
2017-11-27|INCF|Indo Komoditi Korpora Tbk.|292
2017-11-27|INCI|Intanwijaya Internasional Tbk|400
2017-11-27|INCO|Vale Indonesia Tbk.|2940
2017-11-27|INDF|Indofood Sukses Makmur Tbk.|7750
2017-11-27|INDR|Indo-Rama Synthetics Tbk.|1300
2017-11-27|INDS|Indospring Tbk.|1540
2017-11-27|INDX|Tanah Laut Tbk|115
2017-11-27|INDY|Indika Energy Tbk.|2850
2017-11-27|INKP|Indah Kiat Pulp & Paper Tbk.|5700
2017-11-27|INPC|Bank Artha Graha Internasional Tbk.|88
2017-11-27|INPC-W|Waran Seri I Bank Artha Graha Internasio|18
2017-11-27|INPP|Indonesian Paradise Property Tbk.|710
2017-11-27|INRU|Toba Pulp Lestari Tbk.|330
2017-11-27|INTA|Intraco Penta Tbk.|436
2017-11-27|INTA-W|Waran Seri I Intraco Penta Tbk.|173
2017-11-27|INTD|Inter Delta Tbk|410
2017-11-27|INTP|Indocement Tunggal Prakarsa Tbk.|19225
2017-11-27|IPOL|Indopoly Swakarsa Industry Tbk.|140
2017-11-27|ISAT|Indosat Tbk.|5275
2017-11-27|ISSP|Steel Pipe Industry of Indonesia Tbk.|156
2017-11-27|ITMA|Sumber Energi Andalan Tbk.|835
2017-11-27|ITMG|Indo Tambangraya Megah Tbk.|19750
2017-11-27|JAWA|Jaya Agra Wattie Tbk.|197
2017-11-27|JECC|Jembo Cable Company Tbk.|5000
2017-11-27|JGLE|Graha Andrasentra Propertindo Tbk.|120
2017-11-27|JIHD|Jakarta International Hotels & Developme|500
2017-11-27|JKON|Jaya Konstruksi Manggala Pratama Tbk.|530
2017-11-27|JPFA|Japfa Comfeed Indonesia Tbk.|1350
2017-11-27|JPRS|Jaya Pari Steel Tbk|132
2017-11-27|JRPT|Jaya Real Property Tbk.|875
2017-11-27|JSMR|Jasa Marga (Persero) Tbk.|6450
2017-11-27|JTPE|Jasuindo Tiga Perkasa Tbk.|302
2017-11-27|KAEF|Kimia Farma Tbk.|2360
2017-11-27|KARW|ICTSI Jasa Prima Tbk.|112
2017-11-27|KBLI|KMI Wire & Cable Tbk.|470
2017-11-27|KBLM|Kabelindo Murni Tbk.|274
2017-11-27|KBLV|First Media Tbk.|496
2017-11-27|KBRI|Kertas Basuki Rachmat Indonesia Tbk.|50
2017-11-27|KDSI|Kedawung Setia Industrial Tbk.|560
2017-11-27|KICI|Kedaung Indah Can Tbk|194
2017-11-27|KIJA|Kawasan Industri Jababeka Tbk.|298
2017-11-27|KINO|Kino Indonesia Tbk.|2400
2017-11-27|KIOS|Kioson Komersial Indonesia Tbk.|2900
2017-11-27|KIOS-W|Waran Seri I Kioson Komersial Indonesia|2200
2017-11-27|KKGI|Resource Alam Indonesia Tbk.|298
2017-11-27|KLBF|Kalbe Farma Tbk.|1660
2017-11-27|KMTR|Kirana Megatara Tbk.|500
2017-11-27|KOBX|Kobexindo Tractors Tbk.|124
2017-11-27|KONI|Perdana Bangun Pusaka Tbk|338
2017-11-27|KOPI|Mitra Energi Persada Tbk.|750
2017-11-27|KRAH|Grand Kartech Tbk.|2720
2017-11-27|KRAS|Krakatau Steel (Persero) Tbk.|484
2017-11-27|KREN|Kresna Graha Investama Tbk.|535
2017-11-27|LAPD|Leyand International Tbk.|50
2017-11-27|LCGP|Eureka Prima Jakarta Tbk.|94
2017-11-27|LEAD|Logindo Samudramakmur Tbk.|93
2017-11-27|LINK|Link Net Tbk.|4950
2017-11-27|LMAS|Limas Indonesia Makmur Tbk|63
2017-11-27|LMPI|Langgeng Makmur Industri Tbk.|168
2017-11-27|LMSH|Lionmesh Prima Tbk.|640
2017-11-27|LPCK|Lippo Cikarang Tbk|3820
2017-11-27|LPGI|Lippo General Insurance Tbk.|4950
2017-11-27|LPKR|Lippo Karawaci Tbk.|630
2017-11-27|LPLI|Star Pacific Tbk|164
2017-11-27|LPPF|Matahari Department Store Tbk.|11125
2017-11-27|LPPS|Lippo Securities Tbk.|95
2017-11-27|LRNA|Eka Sari Lorena Transport Tbk.|92
2017-11-27|LRNA-W|Waran Seri I Eka Sari Lorena Transport T|18
2017-11-27|LSIP|PP London Sumatra Indonesia Tbk.|1430
2017-11-27|LTLS|Lautan Luas Tbk.|490
2017-11-27|MABA|Marga Abhinaya Abadi Tbk.|1880
2017-11-27|MAGP|Multi Agro Gemilang Plantation Tbk.|50
2017-11-27|MAIN|Malindo Feedmill Tbk.|845
2017-11-27|MAMI|Mas Murni Indonesia Tbk|101
2017-11-27|MAPB|MAP Boga Adiperkasa Tbk.|1970
2017-11-27|MAPI|Mitra Adiperkasa Tbk.|6325
2017-11-27|MARI|Mahaka Radio Integra Tbk.|1205
2017-11-27|MARK|Mark Dynamics Indonesia Tbk.|1655
2017-11-27|MASA|Multistrada Arah Sarana Tbk.|320
2017-11-27|MAYA|Bank Mayapada Internasional Tbk.|3940
2017-11-27|MBAP|Mitrabara Adiperdana Tbk.|3150
2017-11-27|MBSS|Mitrabahtera Segara Sejati Tbk.|775
2017-11-27|MBTO|Martina Berto Tbk.|143
2017-11-27|MCAS|M Cash Integrasi Tbk.|2330
2017-11-27|MCOR|Bank China Construction Bank Indonesia T|224
2017-11-27|MDIA|Intermedia Capital Tbk.|185
2017-11-27|MDKA|Merdeka Copper Gold Tbk.|2350
2017-11-27|MDKI|Emdeki Utama Tbk.|308
2017-11-27|MDLN|Modernland Realty Tbk.|318
2017-11-27|MDRN|Modern Internasional Tbk.|50
2017-11-27|MEDC|Medco Energi Internasional Tbk.|925
2017-11-27|MEGA|Bank Mega Tbk.|2700
2017-11-27|META|Nusantara Infrastructure Tbk.|230
2017-11-27|MFIN|Mandala Multifinance Tbk.|1300
2017-11-27|MFMI|Multifiling Mitra Indonesia Tbk.|800
2017-11-27|MGNA|Magna Investama Mandiri Tbk.|118
2017-11-27|MIDI|Midi Utama Indonesia Tbk.|915
2017-11-27|MIKA|Mitra Keluarga Karyasehat Tbk.|1780
2017-11-27|MINA|Sanurhasta Mitra Tbk.|1965
2017-11-27|MIRA|Mitra International Resources Tbk.|50
2017-11-27|MKNT|Mitra Komunikasi Nusantara Tbk.|246
2017-11-27|MKPI|Metropolitan Kentjana Tbk.|34900
2017-11-27|MLBI|Multi Bintang Indonesia Tbk.|13500
2017-11-27|MLPL|Multipolar Tbk.|159
2017-11-27|MLPT|Multipolar Technology Tbk.|800
2017-11-27|MMLP|Mega Manunggal Property Tbk.|560
2017-11-27|MNCN|Media Nusantara Citra Tbk.|1465
2017-11-27|MPMX|Mitra Pinasthika Mustika Tbk.|955
2017-11-27|MPOW|Megapower Makmur Tbk.|296
2017-11-27|MPPA|Matahari Putra Prima Tbk.|460
2017-11-27|MRAT|Mustika Ratu Tbk.|200
2017-11-27|MSKY|MNC Sky Vision Tbk.|945
2017-11-27|MTDL|Metrodata Electronics Tbk.|600
2017-11-27|MTLA|Metropolitan Land Tbk.|356
2017-11-27|MTRA|Mitra Pemuda Tbk.|262
2017-11-27|MTWI|Malacca Trust Wuwungan Insurance Tbk.|260
2017-11-27|MYOH|Samindo Resources Tbk.|655
2017-11-27|MYOR|Mayora Indah Tbk.|1950
2017-11-27|MYRX|Hanson International Tbk.|107
2017-11-27|MYRXP|Saham Seri B Hanson International Tbk.|50
2017-11-27|MYTX|Asia Pacific Investama Tbk.|144
2017-11-27|NASA|Ayana Land International Tbk.|400
2017-11-27|NASA-W|Waran Seri I Ayana Land International Tb|252
2017-11-27|NELY|Pelayaran Nelly Dwi Putri Tbk.|120
2017-11-27|NIKL|Pelat Timah Nusantara Tbk.|2860
2017-11-27|NIPS|Nipress Tbk.|404
2017-11-27|NIRO|Nirvana Development Tbk.|57
2017-11-27|NISP|Bank OCBC NISP Tbk.|2000
2017-11-27|NOBU|Bank Nationalnobu Tbk.|920
2017-11-27|NRCA|Nusa Raya Cipta Tbk.|428
2017-11-27|OASA|Protech Mitra Perkasa Tbk.|492
2017-11-27|OKAS|Ancora Indonesia Resources Tbk.|496
2017-11-27|PADI|Minna Padi Investama Sekuritas Tbk.|1040
2017-11-27|PALM|Provident Agro Tbk.|310
2017-11-27|PANR|Panorama Sentrawisata Tbk.|555
2017-11-27|PANS|Panin Sekuritas Tbk.|2050
2017-11-27|PBRX|Pan Brothers Tbk.|482
2017-11-27|PGAS|Perusahaan Gas Negara (Persero) Tbk.|1790
2017-11-27|PGLI|Pembangunan Graha Lestari Indah Tbk.|155
2017-11-27|PICO|Pelangi Indah Canindo Tbk|220
2017-11-27|PJAA|Pembangunan Jaya Ancol Tbk.|1505
2017-11-27|PKPK|Perdana Karya Perkasa Tbk|74
2017-11-27|PLAS|Polaris Investama Tbk|50
2017-11-27|PLIN|Plaza Indonesia Realty Tbk.|3560
2017-11-27|PNBN|Bank Pan Indonesia Tbk|1185
2017-11-27|PNBS|Bank Panin Dubai Syariah Tbk.|76
2017-11-27|PNIN|Paninvest Tbk.|865
2017-11-27|PNLF|Panin Financial Tbk.|242
2017-11-27|POLY|Asia Pacific Fibers Tbk|73
2017-11-27|POOL|Pool Advista Indonesia Tbk.|3340
2017-11-27|PORT|Nusantara Pelabuhan Handal Tbk.|350
2017-11-27|POWR|Cikarang Listrindo Tbk.|1160
2017-11-27|PPRE|PP Presisi Tbk.|410
2017-11-27|PPRO|PP Properti Tbk.|204
2017-11-27|PRAS|Prima Alloy Steel Universal Tbk.|226
2017-11-27|PRDA|Prodia Widyahusada Tbk.|3660
2017-11-27|PSAB|J Resources Asia Pasifik Tbk.|186
2017-11-27|PSDN|Prasidha Aneka Niaga Tbk|428
2017-11-27|PSKT|Red Planet Indonesia Tbk.|50
2017-11-27|PTBA|Tambang Batubara Bukit Asam (Persero) Tb|10900
2017-11-27|PTIS|Indo Straits Tbk.|600
2017-11-27|PTPP|PP (Persero) Tbk.|2720
2017-11-27|PTRO|Petrosea Tbk.|1880
2017-11-27|PTSN|Sat Nusapersada Tbk|198
2017-11-27|PUDP|Pudjiadi Prestige Tbk.|492
2017-11-27|PWON|Pakuwon Jati Tbk.|640
2017-11-27|PYFA|Pyridam Farma Tbk|188
2017-11-27|RAJA|Rukun Raharja Tbk.|300
2017-11-27|RALS|Ramayana Lestari Sentosa Tbk.|935
2017-11-27|RANC|Supra Boga Lestari Tbk.|330
2017-11-27|RBMS|Ristia Bintang Mahkotasejati Tbk.|230
2017-11-27|RICY|Ricky Putra Globalindo Tbk|147
2017-11-27|RIGS|Rig Tenders Indonesia Tbk.|193
2017-11-27|RIMO|Rimo International Lestari Tbk|186
2017-11-27|RMBA|Bentoel Internasional Investama Tbk.|396
2017-11-27|RODA|Pikko Land Development Tbk.|175
2017-11-27|ROTI|Nippon Indosari Corpindo Tbk.|1290
2017-11-27|SAME|Sarana Meditama Metropolitan Tbk.|560
2017-11-27|SCCO|Supreme Cable Manufacturing & Commerce T|8875
2017-11-27|SCMA|Surya Citra Media Tbk.|2200
2017-11-27|SDMU|Sidomulyo Selaras Tbk.|200
2017-11-27|SDPC|Millennium Pharmacon International Tbk.|115
2017-11-27|SDRA|Bank Woori Saudara Indonesia 1906 Tbk.|785
2017-11-27|SGRO|Sampoerna Agro Tbk.|2580
2017-11-27|SHIP|Sillo Maritime Perdana Tbk.|765
2017-11-27|SIDO|Industri Jamu dan Farmasi Sido Muncul Tb|505
2017-11-27|SILO|Siloam International Hospitals Tbk.|10150
2017-11-27|SIMA|Siwani Makmur Tbk|324
2017-11-27|SIMP|Salim Ivomas Pratama Tbk.|500
2017-11-27|SIPD|Sierad Produce Tbk.|720
2017-11-27|SKBM|Sekar Bumi Tbk.|510
2017-11-27|SMBR|Semen Baturaja (Persero) Tbk.|2600
2017-11-27|SMCB|Holcim Indonesia Tbk.|815
2017-11-27|SMDM|Suryamas Dutamakmur Tbk.|126
2017-11-27|SMDR|Samudera Indonesia  Tbk.|488
2017-11-27|SMGR|Semen Indonesia (Persero) Tbk.|10150
2017-11-27|SMMT|Golden Eagle Energy Tbk.|133
2017-11-27|SMRA|Summarecon Agung Tbk.|925
2017-11-27|SMRU|SMR Utama Tbk.|478
2017-11-27|SMSM|Selamat Sempurna Tbk.|1285
2017-11-27|SOCI|Soechi Lines Tbk.|298
2017-11-27|SONA|Sona Topas Tourism Industry Tbk.|2100
2017-11-27|SPMA|Suparma Tbk.|250
2017-11-27|SQMI|Renuka Coalindo Tbk.|382
2017-11-27|SRIL|Sri Rejeki Isman Tbk.|384
2017-11-27|SRSN|Indo Acidatama Tbk|50
2017-11-27|SRTG|Saratoga Investama Sedaya Tbk.|3600
2017-11-27|SSIA|Surya Semesta Internusa Tbk.|545
2017-11-27|SSMS|Sawit Sumbermas Sarana Tbk.|1495
2017-11-27|STAR|Star  Petrochem Tbk.|64
2017-11-27|STTP|Siantar Top Tbk.|3900
2017-11-27|SUGI|Sugih Energy Tbk.|50
2017-11-27|SULI|SLJ Global Tbk.|181
2017-11-27|TALF|Tunas Alfin Tbk.|420
2017-11-27|TAMU|Pelayaran Tamarin Samudra Tbk.|3240
2017-11-27|TARA|Sitara Propertindo Tbk.|740
2017-11-27|TAXI|Express Transindo Utama Tbk.|56
2017-11-27|TBIG|Tower Bersama Infrastructure Tbk.|6175
2017-11-27|TBLA|Tunas Baru Lampung Tbk.|1400
2017-11-27|TBMS|Tembaga Mulia Semanan Tbk.|935
2017-11-27|TELE|Tiphone Mobile Indonesia Tbk.|930
2017-11-27|TFCO|Tifico Fiber Indonesia Tbk.|545
2017-11-27|TGKA|Tigaraksa Satria Tbk.|2500
2017-11-27|TGRA|Terregra Asia Energy Tbk.|496
2017-11-27|TIFA|Tifa Finance Tbk.|199
2017-11-27|TINS|Timah (Persero) Tbk.|860
2017-11-27|TIRA|Tira Austenite Tbk|250
2017-11-27|TIRT|Tirta Mahakam Resources Tbk|95
2017-11-27|TKIM|Pabrik Kertas Tjiwi Kimia Tbk.|3560
2017-11-27|TLKM|Telekomunikasi Indonesia (Persero) Tbk.|4320
2017-11-27|TMAS|Pelayaran Tempuran Emas Tbk.|1200
2017-11-27|TOBA|Toba Bara Sejahtra Tbk.|1950
2017-11-27|TOPS|Totalindo Eka Persada Tbk.|3040
2017-11-27|TOTL|Total Bangun Persada Tbk.|670
2017-11-27|TOTO|Surya Toto Indonesia Tbk.|418
2017-11-27|TOWR|Sarana Menara Nusantara Tbk.|3950
2017-11-27|TPIA|Chandra Asri Petrochemical Tbk.|5700
2017-11-27|TPMA|Trans Power Marine Tbk.|174
2017-11-27|TRAM|Trada Alam Minera Tbk.|158
2017-11-27|TRIL|Triwira Insanlestari Tbk.|50
2017-11-27|TRIM|Trimegah Sekuritas Indonesia Tbk.|150
2017-11-27|TRIS|Trisula International Tbk.|306
2017-11-27|TRST|Trias Sentosa Tbk.|370
2017-11-27|TRUS|Trust Finance Indonesia Tbk|127
2017-11-27|TSPC|Tempo Scan Pacific Tbk.|1805
2017-11-27|TURI|Tunas Ridean Tbk.|1135
2017-11-27|ULTJ|Ultra Jaya Milk Industry & Trading Compa|1315
2017-11-27|UNIC|Unggul Indah Cahaya Tbk.|3700
2017-11-27|UNIT|Nusantara Inti Corpora Tbk|210
2017-11-27|UNSP|Bakrie Sumatera Plantations Tbk.|187
2017-11-27|UNTR|United Tractors Tbk.|31700
2017-11-27|UNVR|Unilever Indonesia Tbk.|49800
2017-11-27|VICO|Victoria Investama Tbk.|250
2017-11-27|VINS|Victoria Insurance Tbk.|218
2017-11-27|VINS-W|Waran Seri I Victoria Insurance Tbk.|63
2017-11-27|VIVA|Visi Media Asia Tbk.|228
2017-11-27|VOKS|Voksel Electric Tbk.|280
2017-11-27|VRNA|Verena Multi Finance Tbk.|100
2017-11-27|WAPO|Wahana Pronatural Tbk.|100
2017-11-27|WEHA|WEHA Transportasi Indonesia Tbk.|202
2017-11-27|WICO|Wicaksana Overseas International Tbk.|600
2017-11-27|WIIM|Wismilak Inti Makmur Tbk.|308
2017-11-27|WIKA|Wijaya Karya (Persero) Tbk.|1900
2017-11-27|WINS|Wintermar Offshore Marine Tbk.|318
2017-11-27|WOMF|Wahana Ottomitra Multiartha Tbk.|202
2017-11-27|WOOD|Integra Indocabinet Tbk.|234
2017-11-27|WSBP|Waskita Beton Precast Tbk.|404
2017-11-27|WSKT|Waskita Karya (Persero) Tbk.|2130
2017-11-27|WTON|Wijaya Karya Beton Tbk.|625
2017-11-27|XCID|DIRE Ciptadana Properti Ritel Indonesia|95
2017-11-27|XIIT|Reksa Dana Premier ETF IDX30|570
2017-11-27|XIJI|Reksa Dana Syariah Premier ETF JII|745
2017-11-27|XISR|Premier ETF SRI-KEHATI|377
2017-11-27|YULE|Yulie Sekuritas Indonesia Tbk.|244
2017-11-27|ZINC|Kapuas Prima Coal Tbk.|1065
