AALI|Astra Agro Lestari Tbk.|1924688333|1924688333|515600|140200
ABBA|Mahaka Media Tbk.|2755125000|2755125000|0|0
ABDA|Asuransi Bina Dana Arta Tbk.|620806680|620806680|0|0
ABMM|ABM Investama Tbk.|2753165000|2753165000|0|0
ACES|Ace Hardware Indonesia Tbk.|17150000000|1715000000|9870800|18024600
ACST|Acset Indonusa Tbk.|700000000|700000000|155400|1100
ADES|Akasha Wira International Tbk.|589896800|589896800|0|0
ADHI|Adhi Karya (Persero) Tbk.|3560849376|3560849376|2182800|10407600
ADMF|Adira Dinamika Multi Finance Tbk.|1000000000|1000000000|20600|40400
ADMG|Polychem Indonesia Tbk|3889179559|3889179559|0|0
ADRO|Adaro Energy Tbk.|31985962000|3198596200|27346840|46868740
AGII|Aneka Gas Industri Tbk.|3066660000|3066660000|50000|96200
AGRO|Bank Rakyat Indonesia Agroniaga Tbk.|15172454702|1517245470|1213300|52800
AGRS|Bank Agris Tbk.|5203614878|5203614878|0|0
AHAP|Asuransi Harta Aman Pratama Tbk.|840000000|840000000|0|0
AIMS|Akbar Indo Makmur Stimec Tbk|220000000|220000000|0|0
AISA|Tiga Pilar Sejahtera Food Tbk.|3218600000|3218600000|25229000|30100300
AKKU|Anugerah Kagum Karya Utama Tbk.|6449463636|6449463636|0|0
AKPI|Argha Karya Prima Industry Tbk.|680000000|680000000|0|0
AKRA|AKR Corporindo Tbk.|3991781170|3991781170|2813064|2700614
AKSI|Majapahit Inti Corpora Tbk.|720000000|720000000|0|0
ALDO|Alkindo Naratama Tbk.|550000000|550000000|0|0
ALKA|Alakasa Industrindo Tbk|507665055|507665055|0|0
ALMI|Alumindo Light Metal Industry Tbk.|616000000|616000000|900|0
ALTO|Tri Banyan Tirta Tbk.|2186603355|2186603355|7300|8000
AMAG|Asuransi Multi Artha Guna Tbk.|5001552516|5001552516|0|0
AMFG|Asahimas Flat Glass Tbk.|434000000|434000000|0|2100
AMIN|Ateliers Mecaniques D Indonesie Tbk.|1080000000|1080000000|159000|0
AMRT|Sumber Alfaria Trijaya Tbk.|41524501700|4152450170|33780209|22914609
ANJT|Austindo Nusantara Jaya Tbk.|3354175000|3354175000|0|0
ANTM|Aneka Tambang (Persero) Tbk.|24030764725|2403076472|8975500|24115100
APEX|Apexindo Pratama Duta Tbk.|2659850000|2659850000|0|0
APIC|Pacific Strategic Financial Tbk.|11761995000|1176199500|0|0
APII|Arita Prima Indonesia Tbk.|1075760000|1075760000|0|0
APLI|Asiaplast Industries Tbk.|1500000000|1500000000|450500|0
APLN|Agung Podomoro Land Tbk.|20500900000|2050090000|3251300|8950300
APOL|Arpeni Pratama Ocean Line Tbk.|8670479000|8670479000|0|0
ARGO|Argo Pantes Tbk|335557450|335557450|0|0
ARII|Atlas Resources Tbk.|3000000000|3000000000|0|0
ARNA|Arwana Citramulia Tbk.|7341430976|7341430976|100000|43459900
ARTA|Arthavest Tbk|446674175|446674175|0|0
ARTI|Ratu Prabu Energi Tbk|7840000000|7840000000|0|0
ARTO|Bank Artos Indonesia Tbk.|1194187500|1194187500|0|0
ASBI|Asuransi Bintang Tbk.|348386472|348386472|0|0
ASDM|Asuransi Dayin Mitra Tbk.|192000000|192000000|0|0
ASGR|Astra Graphia Tbk.|1348780500|1348780500|0|0
ASII|Astra International Tbk.|40483553140|4048355314|90649080|105877980
ASJT|Asuransi Jasa Tania Tbk.|600000000|600000000|0|0
ASMI|Asuransi Kresna Mitra Tbk.|8958380460|8958380460|0|0
ASRI|Alam Sutera Realty Tbk.|19649411888|1964941188|186200|7073600
ASRM|Asuransi Ramayana Tbk.|214559422|214559422|0|0
ASSA|Adi Sarana Armada Tbk.|3397500000|3397500000|131000|0
ATIC|Anabatic Technologies Tbk.|1875010000|1875010000|0|0
ATPK|Bara Jaya Internasional Tbk.|5760245414|5760245414|0|0
AUTO|Astra Otoparts Tbk.|4819733000|4819733000|300|7000
BABP|Bank MNC Internasional Tbk.|20375650599|2037565059|0|0
BACA|Bank Capital Indonesia Tbk.|6968511100|6968511100|0|0
BAJA|Saranacentral Bajatama Tbk.|1800000000|1800000000|0|50000
BALI|Bali Towerindo Sentra Tbk.|3634111500|3634111500|0|0
BAPA|Bekasi Asri Pemula Tbk.|661784520|661784520|0|0
BATA|Sepatu Bata Tbk.|1300000000|1300000000|0|300
BAYU|Bayu Buana Tbk|353220780|353220780|0|0
BBCA|Bank Central Asia Tbk.|24408459120|2440845912|21402989|43188089
BBHI|Bank Harda Internasional Tbk.|3613500000|3613500000|0|0
BBKP|Bank Bukopin Tbk.|8995754228|8995754228|1774816|7084200
BBLD|Buana Finance Tbk.|1645796054|1645796054|0|0
BBMD|Bank Mestika Dharma Tbk.|4049189100|4049189100|0|0
BBNI|Bank Negara Indonesia (Persero) Tbk.|18462169893|1846216989|20528628|40210533
BBNP|Bank Nusantara Parahyangan Tbk.|670065543|670065543|0|0
BBRI|Bank Rakyat Indonesia (Persero) Tbk.|24422470380|2442247038|30121149|79210856
BBRM|Pelayaran Nasional Bina Buana Raya Tbk.|5367076248|5367076248|0|0
BBTN|Bank Tabungan Negara (Persero) Tbk.|10484100000|1048410000|14168600|16941300
BBYB|Bank Yudha Bhakti Tbk.|4164629030|4164629030|0|50600
BCAP|MNC Kapital Indonesia Tbk.|5472838318|5472838318|0|0
BCIC|Bank JTrust Indonesia Tbk.|28066675536|2806667553|0|0
BCIP|Bumi Citra Permai Tbk.|1429915525|1429915525|0|100000
BDMN|Bank Danamon Indonesia Tbk.|9488796931|9488796931|11836040|12651440
BEKS|Bank Pembangunan Daerah Banten Tbk.|63468336053|6346833605|0|4100000
BEST|Bekasi Fajar Industrial Estate Tbk.|9647311150|9647311150|8086200|2456700
BFIN|BFI Finance  Indonesia Tbk.|1596711562|1596711562|0|0
BGTG|Bank Ganesha Tbk.|11063309400|1106330940|0|0
BHIT|MNC Investama Tbk.|48057050367|4805705036|32850800|37025900
BIKA|Binakarya Jaya Abadi Tbk.|592280000|592280000|0|0
BIMA|Primarindo Asia Infrastructure Tbk.|608175716|608175716|0|0
BINA|Bank Ina Perdana Tbk.|5597831250|5597831250|4700|2200
BIPI|Benakat Integra Tbk.|36508170014|3650817001|3131100|10000
BIPP|Bhuwanatala Indah Permai Tbk.|4669648582|4669648582|0|0
BIRD|Blue Bird Tbk.|2502100000|2502100000|0|111200
BISI|BISI International Tbk.|3000000000|3000000000|8121200|7953300
BJBR|Bank Pembangunan Daerah Jawa Barat dan B|9599328254|9599328254|3972900|4003200
BJTM|Bank Pembangunan Daerah Jawa Timur Tbk.|14796848606|1479684860|124741183|172307883
BKDP|Bukit Darmo Property Tbk|7315022252|7315022252|0|0
BKSL|Sentul City Tbk.|34536595510|3453659551|0|0
BKSW|Bank QNB Indonesia Tbk.|8669574538|8669574538|0|0
BLTA|Berlian Laju Tanker Tbk|23483317538|2348331753|0|0
BLTZ|Graha Layar Prima Tbk.|436968571|436968571|0|100
BMAS|Bank Maspion Indonesia Tbk.|4399026922|4399026922|0|0
BMRI|Bank Mandiri (Persero) Tbk.|23099999999|2309999999|12155415|24511515
BMSR|Bintang Mitra Semestaraya Tbk|1159200024|1159200024|0|0
BMTR|Global Mediacom Tbk.|14198621422|1419862142|11458500|13846700
BNBA|Bank Bumi Arta Tbk.|2286900000|2286900000|300|100000
BNBR|Bakrie & Brothers Tbk|97021717528|9702171752|0|0
BNGA|Bank CIMB Niaga Tbk.|24880290775|2488029077|9697622|14924100
BNII|Bank Maybank Indonesia Tbk.|67068027368|6706802736|170000|1401000
BNLI|Bank Permata Tbk.|22116530753|2211653075|1500000|10517000
BOGA|Bintang Oto Global Tbk.|3800000000|3800000000|0|0
BOLT|Garuda Metalindo Tbk.|2343750000|2343750000|0|0
BORN|Borneo Lumbung Energi & Metal Tbk.|17693000000|1769300000|0|0
BPFI|Batavia Prosperindo Finance Tbk.|1360627100|1360627100|0|0
BPII|Batavia Prosperindo Internasional Tbk.|514010900|514010900|0|0
BRAM|Indo Kordsa Tbk.|450000000|450000000|0|0
BRAU|Berau Coal Energy Tbk.|34900000000|3490000000|0|0
BRMS|Bumi Resources Minerals Tbk.|25570150644|2557015064|530000|6155900
BRNA|Berlina Tbk.|979110000|979110000|0|127900
BRPT|Barito Pacific Tbk.|6979892784|6979892784|1795367|356667
BSDE|Bumi Serpong Damai Tbk.|19246696192|1924669619|7173960|23839960
BSIM|Bank Sinarmas Tbk.|15055436804|1505543680|0|0
BSSR|Baramulti Suksessarana Tbk.|2616500000|2616500000|0|0
BSWD|Bank Of India Indonesia Tbk.|1031184000|1031184000|0|0
BTEK|Bumi Teknokultura Unggul Tbk|5784687047|5784687047|0|0
BTEL|Bakrie Telecom Tbk.|36773904635|3677390463|0|0
BTON|Betonjaya Manunggal Tbk.|720000000|720000000|0|0
BTPN|Bank Tabungan Pensiunan Nasional Tbk.|5781884384|5781884384|0|4000
BUDI|Budi Starch & Sweetener Tbk.|4498997362|4498997362|0|53000
BUKK|Bukaka Teknik Utama Tbk.|2640452000|2640452000|0|0
BULL|Buana Listya Tama Tbk.|4835252571|4835252571|75000|380000
BUMI|Bumi Resources Tbk.|36627020427|3662702042|134928300|107045400
BUVA|Bukit Uluwatu Villa Tbk.|3405634600|3405634600|0|0
BVIC|Bank Victoria International Tbk.|8592141624|8592141624|16000|0
BWPT|Eagle High Plantations Tbk.|31525291000|3152529100|1011000|10156000
BYAN|Bayan Resources Tbk.|3333333500|3333333500|0|0
CANI|Capitol Nusantara Indonesia Tbk.|833440000|833440000|0|0
CASA|Capital Financial Indonesia Tbk.|11553085336|1155308533|0|0
CASS|Cardig Aero Services Tbk.|2086950000|2086950000|0|0
CEKA|Wilmar Cahaya Indonesia Tbk.|595000000|595000000|0|5000
CENT|Centratama Telekomunikasi Indonesia Tbk.|31183464900|3118346490|0|0
CFIN|Clipan Finance Indonesia Tbk.|3984520457|3984520457|547100|546600
CINT|Chitose Internasional Tbk.|1000000000|1000000000|0|0
CITA|Cita Mineral Investindo Tbk.|3370734900|3370734900|0|0
CKRA|Cakra Mineral Tbk.|5106021090|5106021090|0|0
CLPI|Colorpak Indonesia Tbk.|306338500|306338500|0|0
CMNP|Citra Marga Nusaphala Persada Tbk.|3345831944|3345831944|0|0
CMPP|Rimau Multi Putra Pratama Tbk.|216000000|216000000|0|0
CNKO|Exploitasi Energi Indonesia Tbk.|8956361206|8956361206|0|0
CNTB|Saham Seri B ( Centex Tbk )|130000000|130000000|0|0
CNTX|Century Textile Industry Tbk.|70000000|70000000|0|0
COWL|Cowell Development Tbk.|4871214021|4871214021|0|0
CPGT|Citra Maharlika Nusantara Corpora Tbk.|3972222100|3972222100|0|0
CPIN|Charoen Pokphand Indonesia Tbk|16398000000|1639800000|7031244|14449244
CPRO|Central Proteina Prima Tbk.|40470734746|4047073474|0|0
CSAP|Catur Sentosa Adiprana Tbk.|4053052920|4053052920|0|0
CTBN|Citra Tubindo Tbk.|800371500|800371500|0|0
CTRA|Ciputra Development Tbk.|18560303397|1856030339|33595600|46706700
CTTH|Citatah Tbk.|1230839821|1230839821|0|0
DAJK|Dwi Aneka Jaya Kemasindo Tbk.|2500000000|2500000000|0|0
DART|Duta Anggada Realty Tbk.|3141390962|3141390962|0|0
DAYA|Duta Intidaya Tbk.|2078439000|2078439000|0|0
DEFI|Danasupra Erapacific Tbk|676000000|676000000|0|0
DEWA|Darma Henwa Tbk|21853733792|2185373379|2800000|700000
DGIK|Nusa Konstruksi Enjiniring Tbk.|5541165000|5541165000|0|0
DILD|Intiland Development Tbk.|10365854185|1036585418|2399400|3854300
DKFT|Central Omega Resources Tbk.|5638246600|5638246600|0|10000
DLTA|Delta Djakarta Tbk.|800659050|800659050|0|0
DMAS|Puradelta Lestari Tbk.|48198111100|4819811110|28557800|30095300
DNAR|Bank Dinar Indonesia Tbk.|2227500000|2227500000|0|0
DNET|Indoritel Makmur Internasional Tbk.|14184000000|1418400000|50000|3500
DOID|Delta Dunia Makmur Tbk.|8325016732|8325016732|17619800|533600
DPNS|Duta Pertiwi Nusantara Tbk.|331129952|331129952|0|0
DPUM|Dua Putra Utama Makmur Tbk.|4175000000|4175000000|4200|0
DSFI|Dharma Samudera Fishing Industries Tbk.|1857135500|1857135500|0|0
DSNG|Dharma Satya Nusantara Tbk.|10599842400|1059984240|0|0
DSSA|Dian Swastatika Sentosa Tbk|770552320|770552320|0|0
DUTI|Duta Pertiwi Tbk|1850000000|1850000000|0|0
DVLA|Darya-Varia Laboratoria Tbk.|1120000000|1120000000|0|0
DYAN|Dyandra Media International Tbk.|4272964279|4272964279|0|0
ECII|Electronic City Indonesia Tbk.|1334333000|1334333000|0|0
EKAD|Ekadharma International Tbk.|698775000|698775000|50000|0
ELSA|Elnusa Tbk.|7298500000|7298500000|546900|3132400
ELTY|Bakrieland Development Tbk.|43521913019|4352191301|0|0
EMDE|Megapolitan Developments Tbk.|3350000000|3350000000|1000000|41000
EMTK|Elang Mahkota Teknologi Tbk.|5640032442|5640032442|0|0
ENRG|Energi Mega Persada Tbk.|49106783762|4910678376|0|20000
EPMT|Enseval Putera Megatrading Tbk.|2708640000|2708640000|0|0
ERAA|Erajaya Swasembada Tbk.|2900000000|2900000000|0|748900
ERTX|Eratex Djaja Tbk.|1286539792|1286539792|0|0
ESSA|Surya Esa Perkasa Tbk.|1100000000|1100000000|0|0
ESTI|Ever Shine Tex Tbk.|2015208720|2015208720|0|0
ETWA|Eterindo Wahanatama Tbk|968297000|968297000|0|0
EXCL|XL Axiata Tbk.|10687960423|1068796042|6954388|10539888
FAST|Fast Food Indonesia Tbk.|1995138579|1995138579|100700|52100
FASW|Fajar Surya Wisesa Tbk.|2477888787|2477888787|0|0
FISH|FKS Multi Agro Tbk.|480000000|480000000|0|0
FMII|Fortune Mate Indonesia Tbk|2721000000|2721000000|0|0
FORU|Fortune Indonesia Tbk|465224000|465224000|0|0
FPNI|Lotte Chemical Titan Tbk.|5566414000|5566414000|4200000|316500
FREN|Smartfren Telecom Tbk.|103705870101|1037058701|0|0
GAMA|Gading Development Tbk.|10011027656|1001102765|0|0
GDST|Gunawan Dianjaya Steel Tbk.|8200000000|8200000000|0|0
GDYR|Goodyear Indonesia Tbk.|410000000|410000000|0|0
GEMA|Gema Grahasarana Tbk.|320000000|320000000|0|0
GEMS|Golden Energy Mines Tbk.|5882353000|5882353000|0|0
GGRM|Gudang Garam Tbk.|1924088000|1924088000|1025974|1579020
GIAA|Garuda Indonesia (Persero) Tbk.|25886576254|2588657625|309500|315200
GJTL|Gajah Tunggal Tbk.|3484800000|3484800000|1730600|4492100
GLOB|Global Teleshop Tbk.|1111112000|1111112000|0|0
GMCW|Grahamas Citrawisata Tbk.|58839958|58839958|0|0
GMTD|Gowa Makassar Tourism Development Tbk.|101538000|101538000|0|0
GOLD|Visi Telekomunikasi Infrastruktur Tbk.|314600000|314600000|0|0
GOLL|Golden Plantation Tbk.|3665000009|3665000009|0|0
GPRA|Perdana Gapuraprima Tbk.|4276655336|4276655336|0|0
GREN|Evergreen Invesco Tbk.|4694111791|4694111791|0|0
GSMF|Equity Development Investment Tbk.|7454723337|7454723337|0|0
GTBO|Garda Tujuh Buana Tbk|2500000000|2500000000|0|0
GWSA|Greenwood Sejahtera Tbk.|7800760000|7800760000|0|0
GZCO|Gozco Plantations Tbk.|6000000000|6000000000|1030000|1316800
HADE|HD Capital Tbk|2120000000|2120000000|0|0
HDFA|Radana Bhaskara Finance Tbk.|2329668917|2329668917|0|0
HDTX|Panasia Indo Resources Tbk.|3601462800|3601462800|0|0
HERO|Hero Supermarket Tbk.|4183634000|4183634000|0|0
HEXA|Hexindo Adiperkasa Tbk.|840000000|840000000|188900|197500
HITS|Humpuss Intermoda Transportasi Tbk.|7101084801|7101084801|0|0
HMSP|H.M. Sampoerna Tbk.|116318076900|1163180769|217355400|252395900
HOME|Hotel Mandarine Regency Tbk.|2266550488|2266550488|0|0
HOTL|Saraswati Griya Lestari Tbk.|3550000252|3550000252|0|0
HRUM|Harum Energy Tbk.|2703620000|2703620000|368800|2839400
IATA|Indonesia Transport & Infrastructure Tbk|9646826088|9646826088|0|0
IBFN|Intan Baruprana Finance Tbk.|3173720000|3173720000|0|0
IBST|Inti Bangun Sejahtera Tbk.|1350904927|1350904927|0|0
ICBP|Indofood CBP Sukses Makmur Tbk.|11661908000|1166190800|4455554|6986854
ICON|Island Concepts Indonesia Tbk.|1089750000|1089750000|0|0
IDPR|Indonesia Pondasi Raya Tbk.|2003000000|2003000000|0|0
IGAR|Champion Pacific Indonesia Tbk.|972204500|972204500|0|0
IIKP|Inti Agri Resources Tbk|3360000000|3360000000|0|0
IKAI|Intikeramik Alamasri Industri Tbk.|791383786|791383786|0|0
IKBI|Sumi Indo Kabel Tbk.|1224000000|1224000000|0|0
IMAS|Indomobil Sukses Internasional Tbk.|2765278412|2765278412|0|18000000
IMJS|Indomobil Multi Jasa Tbk.|4325000000|4325000000|0|0
IMPC|Impack Pratama Industri Tbk.|4833500000|4833500000|0|0
INAF|Indofarma Tbk.|3099267500|3099267500|0|49300
INAI|Indal Aluminium Industry Tbk.|316800000|316800000|0|0
INCF|Indo Komoditi Korpora Tbk.|1438370465|1438370465|0|0
INCI|Intanwijaya Internasional Tbk|181035556|181035556|0|0
INCO|Vale Indonesia Tbk.|9936338720|9936338720|3135500|8102802
INDF|Indofood Sukses Makmur Tbk.|8780426500|8780426500|4010064|14351264
INDR|Indo-Rama Synthetics Tbk.|654351707|654351707|0|0
INDS|Indospring Tbk.|656249710|656249710|0|0
INDX|Tanah Laut Tbk|437913588|437913588|4000|7600
INDY|Indika Energy Tbk.|5210192000|5210192000|50000|12500
INKP|Indah Kiat Pulp & Paper Tbk.|5470982941|5470982941|0|0
INPC|Bank Artha Graha Internasional Tbk.|15638231119|1563823111|0|0
INPP|Indonesian Paradise Property Tbk.|11181971732|1118197173|0|0
INRU|Toba Pulp Lestari Tbk.|1388883283|1388883283|0|0
INTA|Intraco Penta Tbk.|2160029220|2160029220|100000|10000
INTD|Inter Delta Tbk|118365600|118365600|0|0
INTP|Indocement Tunggal Prakarsa Tbk.|3681231699|3681231699|2846950|3131450
INVS|Inovisi Infracom Tbk.|9990273135|9990273135|0|0
IPOL|Indopoly Swakarsa Industry Tbk.|6443379509|6443379509|0|0
ISAT|Indosat Tbk.|5433933500|5433933500|18600|840400
ISSP|Steel Pipe Industry of Indonesia Tbk.|7185992035|7185992035|0|0
ITMA|Sumber Energi Andalan Tbk.|680000000|680000000|0|0
ITMG|Indo Tambangraya Megah Tbk.|1129925000|1129925000|1436807|2004457
ITTG|Leo Investments Tbk.|1379000000|1379000000|0|0
JAWA|Jaya Agra Wattie Tbk.|3774685500|3774685500|100000|100000
JECC|Jembo Cable Company Tbk.|151200000|151200000|0|0
JGLE|Graha Andrasentra Propertindo Tbk.|22581909405|2258190940|15000|62000
JIHD|Jakarta International Hotels & Developme|2329040482|2329040482|0|0
JKON|Jaya Konstruksi Manggala Pratama Tbk.|16308519860|1630851986|0|0
JKSW|Jakarta Kyoei Steel Works Tbk.|150000000|150000000|0|0
JPFA|Japfa Comfeed Indonesia Tbk.|11410522910|1141052291|105449000|99600500
JPRS|Jaya Pari Steel Tbk|750000000|750000000|0|0
JRPT|Jaya Real Property Tbk.|13750000000|1375000000|0|6200
JSMR|Jasa Marga (Persero) Tbk.|7257871200|7257871200|3046396|5732796
JSPT|Jakarta Setiabudi Internasional Tbk.|2318736000|2318736000|0|0
JTPE|Jasuindo Tiga Perkasa Tbk.|1713012500|1713012500|0|0
KAEF|Kimia Farma Tbk.|5554000000|5554000000|9900|0
KARW|ICTSI Jasa Prima Tbk.|587152700|587152700|0|0
KBLI|KMI Wire & Cable Tbk.|4007235107|4007235107|350000|7588000
KBLM|Kabelindo Murni Tbk.|1120000000|1120000000|0|0
KBLV|First Media Tbk.|1742167907|1742167907|0|0
KBRI|Kertas Basuki Rachmat Indonesia Tbk.|8687995734|8687995734|0|0
KDSI|Kedawung Setia Industrial Tbk.|405000000|405000000|0|0
KIAS|Keramika Indonesia Assosiasi Tbk.|14929100000|1492910000|0|0
KICI|Kedaung Indah Can Tbk|276000000|276000000|0|0
KIJA|Kawasan Industri Jababeka Tbk.|20662178685|2066217868|203035800|221601200
KINO|Kino Indonesia Tbk.|1428571500|1428571500|87400|0
KKGI|Resource Alam Indonesia Tbk.|1000000000|1000000000|200200|0
KLBF|Kalbe Farma Tbk.|46875122110|4687512211|19768124|29865124
KOBX|Kobexindo Tractors Tbk.|2272500000|2272500000|100000|100000
KOIN|Kokoh Inti Arebama Tbk|980843732|980843732|0|0
KONI|Perdana Bangun Pusaka Tbk|152000000|152000000|0|0
KOPI|Mitra Energi Persada Tbk.|697266668|697266668|0|0
KPIG|MNC Land Tbk.|6891067237|6891067237|5575600|5640600
KRAH|Grand Kartech Tbk.|971190000|971190000|0|0
KRAS|Krakatau Steel (Persero) Tbk.|19346396900|1934639690|216200|2189700
KREN|Kresna Graha Investama Tbk.|18208470100|1820847010|1420600|3997200
LAMI|Lamicitra Nusantara Tbk.|1148418000|1148418000|0|0
LAPD|Leyand International Tbk.|3966350139|3966350139|0|0
LCGP|Eureka Prima Jakarta Tbk.|5630000914|5630000914|0|0
LEAD|Logindo Samudramakmur Tbk.|2577028572|2577028572|0|0
LINK|Link Net Tbk.|3042649384|3042649384|2594800|2639500
LION|Lion Metal Works Tbk.|520160000|520160000|500|0
LMAS|Limas Indonesia Makmur Tbk|787851525|787851525|0|0
LMPI|Langgeng Makmur Industri Tbk.|1008517669|1008517669|0|0
LMSH|Lionmesh Prima Tbk.|96000000|96000000|0|0
LPCK|Lippo Cikarang Tbk|696000000|696000000|71290|260690
LPGI|Lippo General Insurance Tbk.|150000000|150000000|300|0
LPIN|Multi Prima Sejahtera Tbk|21250000|21250000|0|0
LPKR|Lippo Karawaci Tbk.|23077689619|2307768961|23665836|42747536
LPLI|Star Pacific Tbk|1170432803|1170432803|3600|0
LPPF|Matahari Department Store Tbk.|2917918080|2917918080|60340396|64973031
LPPS|Lippo Securities Tbk.|2588250000|2588250000|0|3200
LRNA|Eka Sari Lorena Transport Tbk.|350000022|350000022|0|0
LSIP|PP London Sumatra Indonesia Tbk.|6822863965|6822863965|2288100|5789400
LTLS|Lautan Luas Tbk.|1560000000|1560000000|0|82700
MAGP|Multi Agro Gemilang Plantation Tbk.|9000000004|9000000004|0|0
MAIN|Malindo Feedmill Tbk.|2238750000|2238750000|0|0
MAMI|Mas Murni Indonesia Tbk|3307239903|3307239903|743100|60000
MAMIP|Mas Murni Tbk (Saham Preferen)|6000000|6000000|0|0
MAPI|Mitra Adiperkasa Tbk.|1660000000|1660000000|174600|1042600
MARI|Mahaka Radio Integra Tbk.|525264400|525264400|0|0
MASA|Multistrada Arah Sarana Tbk.|9182946945|9182946945|75600|0
MAYA|Bank Mayapada Internasional Tbk.|4870142382|4870142382|0|0
MBAP|Mitrabara Adiperdana Tbk.|1227271952|1227271952|0|0
MBSS|Mitrabahtera Segara Sejati Tbk.|1750026639|1750026639|0|0
MBTO|Martina Berto Tbk.|1070000000|1070000000|0|0
MCOR|Bank China Construction Bank Indonesia T|16465148150|1646514815|250000|195300
MDIA|Intermedia Capital Tbk.|3921553840|3921553840|0|0
MDKA|Merdeka Copper Gold Tbk.|3569587140|3569587140|184300|0
MDLN|Modernland Realty Tbk.|12533067322|1253306732|3322400|2236600
MDRN|Modern Internasional Tbk.|4574697999|4574697999|12000000|5900000
MEDC|Medco Energi Internasional Tbk.|3332451450|3332451450|3972300|6509700
MEGA|Bank Mega Tbk.|6894138227|6894138227|100|0
MERK|Merck Tbk.|448000000|448000000|0|0
META|Nusantara Infrastructure Tbk.|15235671880|1523567188|1004800|0
MFIN|Mandala Multifinance Tbk.|1325000000|1325000000|41400|300
MFMI|Multifiling Mitra Indonesia Tbk.|757581000|757581000|0|0
MGNA|Magna Finance Tbk.|1002932835|1002932835|0|0
MICE|Multi Indocitra Tbk.|600000000|600000000|0|0
MIDI|Midi Utama Indonesia Tbk.|2882353000|2882353000|0|0
MIKA|Mitra Keluarga Karyasehat Tbk.|14550736000|1455073600|533667300|3038600
MIRA|Mitra International Resources Tbk.|3961452039|3961452039|0|0
MITI|Mitra Investindo Tbk.|1411550800|1411550800|0|41900
MKNT|Mitra Komunikasi Nusantara Tbk.|1000000000|1000000000|0|0
MKPI|Metropolitan Kentjana Tbk.|948194000|948194000|0|0
MLBI|Multi Bintang Indonesia Tbk.|2107000000|2107000000|0|0
MLIA|Mulia Industrindo Tbk|1323000000|1323000000|0|0
MLPL|Multipolar Tbk.|10064747323|1006474732|701900|2672700
MLPT|Multipolar Technology Tbk.|1875000000|1875000000|0|0
MMLP|Mega Manunggal Property Tbk.|5714285000|5714285000|0|887700
MNCN|Media Nusantara Citra Tbk.|14276103500|1427610350|13986296|12993296
MPMX|Mitra Pinasthika Mustika Tbk.|4462963276|4462963276|0|371200
MPPA|Matahari Putra Prima Tbk.|5377962800|5377962800|1639500|736000
MRAT|Mustika Ratu Tbk.|428000000|428000000|0|0
MREI|Maskapai Reasuransi Indonesia Tbk.|388343761|388343761|0|0
MSKY|MNC Sky Vision Tbk.|1554053720|1554053720|195000|200600
MTDL|Metrodata Electronics Tbk.|2376172964|2376172964|52900|7500
MTFN|Capitalinc Investment Tbk.|31842082852|3184208285|0|0
MTLA|Metropolitan Land Tbk.|7655126330|7655126330|0|22984900
MTRA|Mitra Pemuda Tbk.|770000000|770000000|0|0
MTSM|Metro Realty Tbk.|232848000|232848000|0|0
MYOH|Samindo Resources Tbk.|2206312500|2206312500|238100|0
MYOR|Mayora Indah Tbk.|22358699725|2235869972|77000|0
MYRX|Hanson International Tbk.|78719201175|7871920117|1197100|18797700
MYRXP|Saham Seri B Hanson International Tbk.|1120995000|1120995000|0|0
MYTX|Asia Pacific Investama Tbk.|1466666577|1466666577|0|0
NAGA|Bank Mitraniaga Tbk.|1612710000|1612710000|0|0
NELY|Pelayaran Nelly Dwi Putri Tbk.|2350000000|2350000000|0|0
NIKL|Pelat Timah Nusantara Tbk.|2523350000|2523350000|0|0
NIPS|Nipress Tbk.|1635333332|1635333332|0|0
NIRO|Nirvana Development Tbk.|22198871804|2219887180|0|0
NISP|Bank OCBC NISP Tbk.|11357888016|1135788801|0|0
NOBU|Bank Nationalnobu Tbk.|4393533177|4393533177|0|0
NRCA|Nusa Raya Cipta Tbk.|2496258344|2496258344|9|999500
OASA|Protech Mitra Perkasa Tbk.|358600000|358600000|0|0
OCAP|Onix Capital Tbk.|273200000|273200000|0|0
OKAS|Ancora Indonesia Resources Tbk.|1765927777|1765927777|0|0
OMRE|Indonesia Prima Property Tbk|1745000000|1745000000|0|0
PADI|Minna Padi Investama Tbk.|11307246524|1130724652|0|0
PALM|Provident Agro Tbk.|7119540356|7119540356|200000|11872300
PANR|Panorama Sentrawisata Tbk.|1200000000|1200000000|0|0
PANS|Panin Sekuritas Tbk.|720000000|720000000|0|100
PBRX|Pan Brothers Tbk.|6478295611|6478295611|893500|1800
PBSA|Paramita Bangun Sarana Tbk.|1500000000|1500000000|0|0
PDES|Destinasi Tirta Nusantara Tbk|715000000|715000000|0|0
PEGE|Panca Global Securities Tbk.|708354264|708354264|0|0
PGAS|Perusahaan Gas Negara (Persero) Tbk.|24241508196|2424150819|20082756|33628760
PGLI|Pembangunan Graha Lestari Indah Tbk.|488000000|488000000|0|0
PICO|Pelangi Indah Canindo Tbk|568375000|568375000|0|0
PJAA|Pembangunan Jaya Ancol Tbk.|1599999996|1599999996|0|0
PKPK|Perdana Karya Perkasa Tbk|600000000|600000000|151600|100000
PLAS|Polaris Investama Tbk|1184200000|1184200000|35800|0
PLIN|Plaza Indonesia Realty Tbk.|3550000000|3550000000|100|100
PNBN|Bank Pan Indonesia Tbk|23837645998|2383764599|26200|716800
PNBS|Bank Panin Syariah Tbk.|10088335256|1008833525|0|0
PNIN|Paninvest Tbk.|4068323920|4068323920|0|0
PNLF|Panin Financial Tbk.|32022073293|3202207329|8416000|13053100
PNSE|Pudjiadi & Sons Tbk.|797813496|797813496|0|0
POLY|Asia Pacific Fibers Tbk|2495753334|2495753334|0|0
POOL|Pool Advista Indonesia Tbk.|1800031988|1800031988|0|0
PORT|Nusantara Pelabuhan Handal Tbk.|2813941985|2813941985|20000|0
POWR|Cikarang Listrindo Tbk.|16087156000|1608715600|252900|359400
PPRO|PP Properti Tbk.|56177624000|5617762400|494100|10023100
PRAS|Prima Alloy Steel Universal Tbk.|701043478|701043478|0|0
PRDA|Prodia Widyahusada Tbk.|937500000|937500000|61600|0
PSAB|J Resources Asia Pasifik Tbk.|26460000000|2646000000|0|152000
PSDN|Prasidha Aneka Niaga Tbk|1440000000|1440000000|0|0
PSKT|Red Planet Indonesia Tbk.|10351231636|1035123163|0|0
PTBA|Tambang Batubara Bukit Asam (Persero) Tb|2304131850|2304131850|1461900|1730900
PTIS|Indo Straits Tbk.|550165300|550165300|0|0
PTPP|PP (Persero) Tbk.|6199897354|6199897354|32762785|35199185
PTRO|Petrosea Tbk.|1008605000|1008605000|109500|522900
PTSN|Sat Nusapersada Tbk|1771448000|1771448000|0|0
PTSP|Pioneerindo Gourmet International Tbk.|220808000|220808000|0|0
PUDP|Pudjiadi Prestige Tbk.|329560000|329560000|0|0
PWON|Pakuwon Jati Tbk.|48159602400|4815960240|16489616|47122716
PYFA|Pyridam Farma Tbk|535080000|535080000|0|0
R-ABFII|Asian Bond Fund - Indonesia Bond Index F|103273644|103273644|0|0
R-LQ45X|Premier ETF LQ-45 (R-LQ45X)|447200000|447200000|0|0
RAJA|Rukun Raharja Tbk.|4077082500|4077082500|0|0
RALS|Ramayana Lestari Sentosa Tbk.|7096000000|7096000000|13659600|8002900
RANC|Supra Boga Lestari Tbk.|1564487500|1564487500|0|0
RBMS|Ristia Bintang Mahkotasejati Tbk.|326722500|326722500|0|0
RDTX|Roda Vivatex Tbk|268800000|268800000|200|100
RELI|Reliance Securities Tbk|1800000000|1800000000|0|0
RICY|Ricky Putra Globalindo Tbk|641717510|641717510|0|0
RIGS|Rig Tenders Indonesia Tbk.|609130000|609130000|0|0
RIMO|Rimo International Lestari Tbk|340000000|340000000|0|0
RMBA|Bentoel Internasional Investama Tbk.|36401136250|3640113625|0|0
RODA|Pikko Land Development Tbk.|13592128209|1359212820|0|0
ROTI|Nippon Indosari Corpindo Tbk.|5061800000|5061800000|1160200|1385800
RUIS|Radiant Utama Interinsco Tbk.|770000000|770000000|0|0
