1563,LQ45U7,LQ45 Futures 2017 September,
1562,BM10H8,BM10 Futures 2018 Maret,
1561,BM05H8,BM05 Futures 2018 Maret,
1560,MABA,Marga Abhinaya Abadi Tbk.,
1559,HOKI-W,Waran Seri I Buyung Poetra Sembada Tbk.,
1558,HOKI,Buyung Poetra Sembada Tbk.,
1557,SDRA-R,HMETD Bank Woori Saudara Indonesia 1906 Tbk.,
1556,MAPB,MAP Boga Adiperkasa Tbk.,
1555,WOOD,Integra Indocabinet Tbk.,
1554,HRTA,Hartadinata Abadi Tbk.,
1553,ARMY,Armidian Karyatama Tbk.,
1552,KMTR,Kirana Megatara Tbk.,
1551,TOPS,Totalindo Eka Persada Tbk.,
1550,XPLC,Reksa Dana Pinnacle Indonesia Large-Cap ETF,
1549,XPDV,Reksa Dana Pinnacle Core High Dividend ETF,
1548,FIRE-W,Waran Seri I Alfa Energi Investama Tbk.,
1547,FIRE,Alfa Energi Investama Tbk.,
1546,FINN,First Indo American Leasing Tbk.,
1544,INTA-W,Waran Seri I Intraco Penta Tbk.,
1543,LQ45Q7,LQ45 Futures 2017 Agustus,
1541,TGRA,Terregra Asia Energy Tbk.,
1539,TAMU,Pelayaran Tamarin Samudra Tbk.,
1538,CSIS,Cahayasakti Investindo Sukses Tbk.,
1537,BM10Z7,BM10 Futures 2017 Desember,
1536,BM10U7,BM10 Futures 2017 September,
1535,BM10M7,BM10 Futures 2017 Juni,
1534,BM05Z7,BM05 Futures 2017 Desember,
1533,BM05U7,BM05 Futures 2017 September,
1532,BM05M7,BM05 Futures 2017 Juni,
1531,BM10,Benchmark Bond 10,
1530,BM05,Benchmark Bond 05,
1529,CLEO,Sariguna Primatirta Tbk.,
1528,LQ45N7,LQ45 Futures 2017 Juli,
1527,FORZ-W,Waran Seri I Forza Land Indonesia Tbk.,
1526,MINA,Sanurhasta Mitra Tbk.,
1525,FORZ,Forza Land Indonesia Tbk.,
1523,CARS,Industri dan Perdagangan Bintraco Dharma Tbk.,
1521,BKSL-W,Waran Seri I Sentul City Tbk.,
1520,LQ45M7,LQ45 Futures 2017 Juni,
1517,PORT,Nusantara Pelabuhan Handal Tbk.,
1515,POOL-W,Waran Seri II Pool Advista Indonesia Tbk.,
1513,BULL-W,Waran Seri II Buana Listya Tama Tbk.,
1509,XISB,Reksa Dana Premier ETF Indonesia Sovereign Bonds,
1504,BOGA-W,Waran Seri I Bintang Oto Global Tbk.,
1503,BOGA,Bintang Oto Global Tbk.,
1502,AGRO-W,Waran Seri II Bank Rakyat Indonesia Agroniaga Tbk.,
1497,INPC-W,Waran Seri I Bank Artha Graha Internasional Tbk.,
1496,PRDA,Prodia Widyahusada Tbk.,
1485,APIC-W,Waran Seri II Pacific Strategic Financial Tbk.,
1482,BABP-W2,Waran Seri III Bank MNC Internasional Tbk.,
1480,AGII,Aneka Gas Industri Tbk.,
1478,PBSA,Paramita Bangun Sarana Tbk.,
1477,WSBP,Waskita Beton Precast Tbk.,
1475,INCF,Indo Komoditi Korpora Tbk.,
1472,XPLQ,Reksa Dana Pinnacle Enhanced Liquid ETF,
1468,CASA-W,Waran Seri I Capital Financial Indonesia Tbk.,
1467,CASA,Capital Financial Indonesia Tbk.,
1466,OASA,Protech Mitra Perkasa Tbk.,
1461,JGLE,Graha Andrasentra Propertindo Tbk.,
1460,DAYA,Duta Intidaya Tbk.,
1459,SHIP,Sillo Maritime Perdana Tbk.,
1456,POWR,Cikarang Listrindo Tbk.,
1449,BBYB-W,Waran Seri I Bank Yudha Bhakti Tbk.,
1447,BSIM-W3,Waran Seri III Bank Sinarmas Tbk.,
1446,BGTG,Bank Ganesha Tbk.,
1440,MARI,Mahaka Radio Integra Tbk.,
1439,MTRA,Mitra Pemuda Tbk.,
1435,ARTO,Bank Artos Indonesia Tbk.,
1433,BACA-W2,Waran Seri III Bank Capital Indonesia Tbk.,
1431,KINO,Kino Indonesia Tbk.,
1430,AMIN,Ateliers Mecaniques D Indonesie Tbk.,
1429,IDPR,Indonesia Pondasi Raya Tbk.,
1428,DPUM,Dua Putra Utama Makmur Tbk.,
1425,MKNT,Mitra Komunikasi Nusantara Tbk.,
1419,XISC,Reksa Dana Premier ETF Indonesia Stated-Owned Companies,
1418,VINS-W,Waran Seri I Victoria Insurance Tbk.,
1417,VINS,Victoria Insurance Tbk.,
1415,BBHI,Bank Harda Internasional Tbk.,
1414,BIKA,Binakarya Jaya Abadi Tbk.,
1412,BIPP-W2,Waran Seri IV Bhuwanatala Indah Permai Tbk.,
1410,ATIC,Anabatic Technologies Tbk.,
1409,BOLT,Garuda Metalindo Tbk.,
1406,BUKK,Bukaka Teknik Utama Tbk.,
1401,MDKA,Merdeka Copper Gold Tbk.,
1400,MMLP,Mega Manunggal Property Tbk.,
1399,DMAS,Puradelta Lestari Tbk.,
1398,PPRO,PP Properti Tbk.,
1396,KOPI,Mitra Energi Persada Tbk.,
1395,MIKA,Mitra Keluarga Karyasehat Tbk.,
1393,BBYB,Bank Yudha Bhakti Tbk.,
1389,GOLL-W,Waran Seri I Golden Plantation Tbk.,
1388,GOLL,Golden Plantation Tbk.,
1387,AGRS,Bank Agris Tbk.,
1386,IBFN,Intan Baruprana Finance Tbk.,
1385,IMPC,Impack Pratama Industri Tbk.,
1380,SOCI,Soechi Lines Tbk.,
1378,XIIF,Reksa Dana Premier ETF Indonesia Financial,
1377,BIRD,Blue Bird Tbk.,
1376,XISR,Premier ETF SRI-KEHATI,
1370,TARA-W,Waran Seri I Sitara Propertindo Tbk.,
1369,TARA,Sitara Propertindo Tbk.,
1368,TKIM-W,Waran Seri II Pabrik Kertas Tjiwi Kimia Tbk.,
1366,DNAR,Bank Dinar Indonesia Tbk.,
1365,MBAP,Mitrabara Adiperdana Tbk.,
1364,BPII,Batavia Prosperindo Internasional Tbk.,
1363,MGNA-W,Waran Seri I Magna Finance Tbk.,
1362,MGNA,Magna Finance Tbk.,
1358,CINT,Chitose Internasional Tbk.,
1356,PSKT-W,Waran Seri I Red Planet Indonesia Tbk.,
1354,LINK,Link Net Tbk.,
1353,DAJK,Dwi Aneka Jaya Kemasindo Tbk.,
1351,LRNA-W,Waran Seri I Eka Sari Lorena Transport Tbk.,
1350,LRNA,Eka Sari Lorena Transport Tbk.,
1348,MDIA,Intermedia Capital Tbk.,
1347,BLTZ,Graha Layar Prima Tbk.,
1345,WTON,Wijaya Karya Beton Tbk.,
1343,BALI-W,Waran Seri I Bali Towerindo Sentra Tbk.,
1342,BALI,Bali Towerindo Sentra Tbk.,
1341,XISI,Premier ETF SMinfra18,
1339,TALF,Tunas Alfin Tbk.,
1338,BINA,Bank Ina Perdana Tbk.,
1337,CANI,Capitol Nusantara Indonesia Tbk.,
1335,ASMI,Asuransi Kresna Mitra Tbk.,
1332,PNBS,Bank Panin Dubai Syariah Tbk.,
1327,SIDO,Industri Jamu dan Farmasi Sido Muncul Tbk.,
1325,SSMS,Sawit Sumbermas Sarana Tbk.,
1324,LEAD,Logindo Samudramakmur Tbk.,
1323,IMJS,Indomobil Multi Jasa Tbk.,
1315,KRAH,Grand Kartech Tbk.,
1312,APII,Arita Prima Indonesia Tbk.,
1309,BACA-W,Waran Seri II Bank Capital Indonesia Tbk.,
1308,SILO,Siloam International Hospitals Tbk.,
1306,XCID,DIRE Ciptadana Properti Ritel Indonesia,
1301,BMAS,Bank Maspion Indonesia Tbk.,
1299,NAGA,Bank Mitraniaga Tbk.,
1298,CPGT,Citra Maharlika Nusantara Corpora Tbk.,
1297,BBMD,Bank Mestika Dharma Tbk.,
1294,VICO,Victoria Investama Tbk.,
1293,MLPT,Multipolar Technology Tbk.,
1291,ECII,Electronic City Indonesia Tbk.,
1290,SMBR,Semen Baturaja (Persero) Tbk.,
1288,NRCA,Nusa Raya Cipta Tbk.,
1287,SRTG,Saratoga Investama Sedaya Tbk.,
1286,ACST,Acset Indonusa Tbk.,
1283,SRIL,Sri Rejeki Isman Tbk.,
1282,DSNG,Dharma Satya Nusantara Tbk.,
1279,APEX,Apexindo Pratama Duta Tbk.,
1278,MPMX,Mitra Pinasthika Mustika Tbk.,
1277,NOBU,Bank Nationalnobu Tbk.,
1275,ANJT,Austindo Nusantara Jaya Tbk.,
1273,XIJI,Reksa Dana Syariah Premier ETF JII,
1272,XIIC,Reksa Dana Premier ETF Indonesia Consumer,
1270,DYAN,Dyandra Media International Tbk.,
1268,ISSP,Steel Pipe Industry of Indonesia Tbk.,
1267,TPMA,Trans Power Marine Tbk.,
1263,MAGP,Multi Agro Gemilang Plantation Tbk.,
1262,SAME,Sarana Meditama Metropolitan Tbk.,
1261,HOTL-W,Waran Seri I Saraswati Griya Lestari Tbk.,
1260,HOTL,Saraswati Griya Lestari Tbk.,
1259,BBRM,Pelayaran Nasional Bina Buana Raya Tbk.,
1254,WSKT,Waskita Karya (Persero) Tbk.,
1253,WIIM,Wismilak Inti Makmur Tbk.,
1249,BIPP-W,Waran Seri III Bhuwanatala Indah Permai Tbk.,
1245,ASSA,Adi Sarana Armada Tbk.,
1244,BSSR,Baramulti Suksessarana Tbk.,
1242,TAXI,Express Transindo Utama Tbk.,
1240,XIIT,Reksa Dana Premier ETF IDX30,
1239,NELY,Pelayaran Nelly Dwi Putri Tbk.,
1238,PALM,Provident Agro Tbk.,
1237,SKBM,Sekar Bumi Tbk.,
1234,NIRO,Nirvana Development Tbk.,
1233,IBST,Inti Bangun Sejahtera Tbk.,
1230,BJTM,Bank Pembangunan Daerah Jawa Timur Tbk.,
1225,GAMA,Gading Development Tbk.,
1224,ALTO-W,Waran Seri I Tri Banyan Tirta Tbk.,
1223,GLOB,Global Teleshop Tbk.,
1222,ALTO,Tri Banyan Tirta Tbk.,
1221,MSKY,MNC Sky Vision Tbk.,
1220,TOBA,Toba Bara Sejahtra Tbk.,
1219,KOBX,Kobexindo Tractors Tbk.,
1213,TRIS-W,Waran Seri I Trisula International Tbk.,
1212,TRIS,Trisula International Tbk.,
1211,RANC,Supra Boga Lestari Tbk.,
1204,BEST,Bekasi Fajar Industrial Estate Tbk.,
1201,ESSA,Surya Esa Perkasa Tbk.,
1198,TELE,Tiphone Mobile Indonesia Tbk.,
1197,PADI,Minna Padi Investama Sekuritas Tbk.,
1193,GWSA,Greenwood Sejahtera Tbk.,
1192,BAJA,Saranacentral Bajatama Tbk.,
1190,ERAA,Erajaya Swasembada Tbk.,
1186,ABMM,ABM Investama Tbk.,
1185,CASS,Cardig Aero Services Tbk.,
1182,VIVA,Visi Media Asia Tbk.,
1181,GEMS,Golden Energy Mines Tbk.,
1178,ARII,Atlas Resources Tbk.,
1176,SUPR,Solusi Tunas Pratama Tbk.,
1175,SMRU,SMR Utama Tbk.,
1167,STAR,Star  Petrochem Tbk.,
1165,ALDO,Alkindo Naratama Tbk.,
1164,PTIS,Indo Straits Tbk.,
1163,SDMU,Sidomulyo Selaras Tbk.,
1159,TIFA,Tifa Finance Tbk.,
1154,MTLA,Metropolitan Land Tbk.,
1153,SIMP,Salim Ivomas Pratama Tbk.,
1152,JAWA,Jaya Agra Wattie Tbk.,
1150,BULL,Buana Listya Tama Tbk.,
1146,HDFA,Radana Bhaskara Finance Tbk.,
1144,SRAJ,Sejahteraraya Anugrahjaya Tbk.,
1143,MBSS,Mitrabahtera Segara Sejati Tbk.,
1140,GIAA,Garuda Indonesia (Persero) Tbk.,
1138,MBTO,Martina Berto Tbk.,
1137,EMDE,Megapolitan Developments Tbk.,
1130,MFMI,Multifiling Mitra Indonesia Tbk.,
1127,BSIM,Bank Sinarmas Tbk.,
1123,BRMS,Bumi Resources Minerals Tbk.,
1119,MIDI,Midi Utama Indonesia Tbk.,
1118,WINS,Wintermar Offshore Marine Tbk.,
1116,BORN,Borneo Lumbung Energi & Metal Tbk.,
1113,APLN,Agung Podomoro Land Tbk.,
1112,KRAS,Krakatau Steel (Persero) Tbk.,
1111,TBIG,Tower Bersama Infrastructure Tbk.,
1109,ICBP,Indofood CBP Sukses Makmur Tbk.,
1108,HRUM,Harum Energy Tbk.,
1107,BRAU,Berau Coal Energy Tbk.,
1100,BUVA,Bukit Uluwatu Villa Tbk.,
1096,GREN,Evergreen Invesco Tbk.,
1094,IPOL,Indopoly Swakarsa Industry Tbk.,
1093,BJBR,Bank Pembangunan Daerah Jawa Barat dan Banten Tbk.,
1091,SKYB,Skybee Tbk.,
1090,GOLD,Visi Telekomunikasi Infrastruktur Tbk.,
1088,ROTI,Nippon Indosari Corpindo Tbk.,
1075,TOWR,Sarana Menara Nusantara Tbk.,
1071,BIPI,Benakat Integra Tbk.,
1070,PTPP,PP (Persero) Tbk.,
1063,EMTK,Elang Mahkota Teknologi Tbk.,
1061,GDST,Gunawan Dianjaya Steel Tbk.,
1060,BBTN,Bank Tabungan Negara (Persero) Tbk.,
1059,NIKL,Pelat Timah Nusantara Tbk.,
1057,BCIP,Bumi Citra Permai Tbk.,
1055,DSSA,Dian Swastatika Sentosa Tbk,
1050,BWPT,Eagle High Plantations Tbk.,
1042,MKPI,Metropolitan Kentjana Tbk.,
1041,GTBO,Garda Tujuh Buana Tbk,
1039,INVS,Inovisi Infracom Tbk.,
1035,BPFI,Batavia Prosperindo Finance Tbk.,
1033,TRIO,Trikomsel Oke Tbk.,
1027,AMRT,Sumber Alfaria Trijaya Tbk.,
1020,SIAP,Sekawan Intipratama Tbk,
1015,TRAM,Trada Maritime Tbk.,
1013,BYAN,Bayan Resources Tbk.,
1011,HOME,Hotel Mandarine Regency Tbk.,
1010,ADRO,Adaro Energy Tbk.,
1004,KBRI,Kertas Basuki Rachmat Indonesia Tbk.,
999,PDES,Destinasi Tirta Nusantara Tbk,
995,VRNA,Verena Multi Finance Tbk.,
992,INDY,Indika Energy Tbk.,
991,BSDE,Bumi Serpong Damai Tbk.,
990,TPIA,Chandra Asri Petrochemical Tbk.,
989,GZCO,Gozco Plantations Tbk.,
982,KOIN,Kokoh Inti Arebama Tbk,
977,BTPN,Bank Tabungan Pensiunan Nasional Tbk.,
975,YPAS,Yanaprima Hastapersada Tbk,
973,ELSA,Elnusa Tbk.,
972,TRIL,Triwira Insanlestari Tbk.,
964,BAPA,Bekasi Asri Pemula Tbk.,
960,DGIK,Nusa Konstruksi Enjiniring Tbk.,
959,COWL,Cowell Development Tbk.,
958,R-LQ45X,Premier ETF LQ-45 (R-LQ45X),
957,R-ABFII,Asian Bond Fund - Indonesia Bond Index Fund,
956,ITMG,Indo Tambangraya Megah Tbk.,
954,ASRI,Alam Sutera Realty Tbk.,
951,CSAP,Catur Sentosa Adiprana Tbk.,
948,JKON,Jaya Konstruksi Manggala Pratama Tbk.,
945,MYOH,Samindo Resources Tbk.,
944,KBLV,First Media Tbk.,
943,SMMT,Golden Eagle Energy Tbk.,
942,PSKT,Red Planet Indonesia Tbk.,
941,PSAB,J Resources Asia Pasifik Tbk.,
940,PGLI,Pembangunan Graha Lestari Indah Tbk.,
939,INPP,Indonesian Paradise Property Tbk.,
938,ICON,Island Concepts Indonesia Tbk.,
937,GMCW,Grahamas Citrawisata Tbk.,
934,OKAS,Ancora Indonesia Resources Tbk.,
933,OCAP,Onix Capital Tbk.,
932,DKFT,Central Omega Resources Tbk.,
931,AGRO,Bank Rakyat Indonesia Agroniaga Tbk.,
929,SCBD,Danayasa Arthatama Tbk.,
925,INRU,Toba Pulp Lestari Tbk.,
922,ITMA,Sumber Energi Andalan Tbk.,
921,KIAS,Keramika Indonesia Assosiasi Tbk.,
917,JSMR,Jasa Marga (Persero) Tbk.,
916,PTSN,Sat Nusapersada Tbk,
914,ACES,Ace Hardware Indonesia Tbk.,
912,WIKA,Wijaya Karya (Persero) Tbk.,
911,GPRA,Perdana Gapuraprima Tbk.,
910,BACA,Bank Capital Indonesia Tbk.,
908,DEWA,Darma Henwa Tbk,
896,LCGP,Eureka Prima Jakarta Tbk.,
893,PKPK,Perdana Karya Perkasa Tbk,
889,MCOR,Bank China Construction Bank Indonesia Tbk.,
885,MNCN,Media Nusantara Citra Tbk.,
882,SGRO,Sampoerna Agro Tbk.,
880,BKDP,Bukit Darmo Property Tbk,
875,WEHA,WEHA Transportasi Indonesia Tbk.,
874,BISI,BISI International Tbk.,
864,SDRA,Bank Woori Saudara Indonesia 1906 Tbk.,
857,FREN,Smartfren Telecom Tbk.,
852,CPRO,Central Proteina Prima Tbk.,
850,TRUB,Truba Alam Manunggal Engineering Tbk.,
848,IATA,Indonesia Transport & Infrastructure Tbk.,
847,TOTL,Total Bangun Persada Tbk.,
838,RUIS,Radiant Utama Interinsco Tbk.,
837,BBKP,Bank Bukopin Tbk.,
830,BNBA,Bank Bumi Arta Tbk.,
829,RAJA,Rukun Raharja Tbk.,
826,MAIN,Malindo Feedmill Tbk.,
824,BTEL,Bakrie Telecom Tbk.,
818,AMAG,Asuransi Multi Artha Guna Tbk.,
817,MICE,Multi Indocitra Tbk.,
814,EXCL,XL Axiata Tbk.,
810,MFIN,Mandala Multifinance Tbk.,
806,RELI,Reliance Securities Tbk,
801,PEGE,Panca Global Securities Tbk.,
800,APOL,Arpeni Pratama Ocean Line Tbk.,
799,MASA,Multistrada Arah Sarana Tbk.,
791,WOMF,Wahana Ottomitra Multiartha Tbk.,
790,YULE,Yulie Sekurindo Tbk,
788,MAPI,Mitra Adiperkasa Tbk.,
786,AKKU,Anugerah Kagum Karya Utama Tbk.,
779,SQMI,Renuka Coalindo Tbk.,
776,PJAA,Pembangunan Jaya Ancol Tbk.,
771,ENRG,Energi Mega Persada Tbk.,
767,BTEK,Bumi Teknokultura Unggul Tbk,
766,HADE,HD Capital Tbk,
765,ADMF,Adira Dinamika Multi Finance Tbk.,
763,ADHI,Adhi Karya (Persero) Tbk.,
760,ASJT,Asuransi Jasa Tania Tbk.,
757,PGAS,Perusahaan Gas Negara (Persero) Tbk.,
755,BBRI,Bank Rakyat Indonesia (Persero) Tbk.,
747,BMRI,Bank Mandiri (Persero) Tbk.,
746,TMAS,Pelayaran Tempuran Emas Tbk.,
742,ARTI,Ratu Prabu Energi Tbk,
734,PTBA,Tambang Batubara Bukit Asam (Persero) Tbk.,
732,APIC,Pacific Strategic Financial Tbk.,
730,TRUS,Trust Finance Indonesia Tbk,
727,BKSW,Bank QNB Indonesia Tbk.,
726,ARTA,Arthavest Tbk,
721,IIKP,Inti Agri Resources Tbk,
718,GEMA,Gema Grahasarana Tbk.,
714,SCMA,Surya Citra Media Tbk.,
713,BABP,Bank MNC Internasional Tbk.,
707,KREN,Kresna Graha Investama Tbk.,
705,SUGI,Sugih Energy Tbk.,
702,BSWD,Bank Of India Indonesia Tbk.,
700,UNIT,Nusantara Inti Corpora Tbk,
699,ATPK,Bara Jaya Internasional Tbk.,
697,JTPE,Jasuindo Tiga Perkasa Tbk.,
688,ABBA,Mahaka Media Tbk.,
687,FPNI,Lotte Chemical Titan Tbk.,
685,CITA,Cita Mineral Investindo Tbk.,
681,FISH,FKS Multi Agro Tbk.,
679,FORU,Fortune Indonesia Tbk,
676,LMAS,Limas Indonesia Makmur Tbk,
671,CLPI,Colorpak Indonesia Tbk.,
669,ITTG,Leo Investments Tbk.,
667,CNKO,Exploitasi Energi Indonesia Tbk.,
663,CENT,Centratama Telekomunikasi Indonesia Tbk.,
661,RODA,Pikko Land Development Tbk.,
657,PYFA,Pyridam Farma Tbk,
656,PANR,Panorama Sentrawisata Tbk.,
651,AIMS,Akbar Indo Makmur Stimec Tbk,
645,META,Nusantara Infrastructure Tbk.,
643,LAMI,Lamicitra Nusantara Tbk.,
642,BTON,Betonjaya Manunggal Tbk.,
641,ARNA,Arwana Citramulia Tbk.,
639,LAPD,Leyand International Tbk.,
638,AKSI,Majapahit Inti Corpora Tbk.,
636,BEKS,Bank Pembangunan Daerah Banten Tbk.,
635,DEFI,Danasupra Erapacific Tbk,
634,KAEF,Kimia Farma Tbk.,
632,WAPO,Wahana Pronatural Tbk.,
630,DOID,Delta Dunia Makmur Tbk.,
628,BCAP,MNC Kapital Indonesia Tbk.,
626,INDX,Tanah Laut Tbk,
618,SQBB,Taisho Pharmaceutical Indonesia Tbk.,
617,INAF,Indofarma Tbk.,
613,PLAS,Polaris Investama Tbk,
606,BBNP,Bank Nusantara Parahyangan Tbk.,
600,TMPO,Tempo Intimedia Tbk.,
599,CNTB,Saham Seri B ( Centex Tbk ),
597,DNET,Indoritel Makmur Internasional Tbk.,
596,GMTD,Gowa Makassar Tourism Development Tbk.,
592,RIMO,Rimo International Lestari Tbk,
590,MYRXP,Saham Seri B Hanson International Tbk.,
567,FMII,Fortune Mate Indonesia Tbk,
562,PANS,Panin Sekuritas Tbk.,
561,BBCA,Bank Central Asia Tbk.,
559,APLI,Asiaplast Industries Tbk.,
558,MAMIP,Mas Murni Tbk (Saham Preferen),
557,MEGA,Bank Mega Tbk.,
555,KPIG,MNC Land Tbk.,
551,DSFI,Dharma Samudera Fishing Industries Tbk.,
548,TBLA,Tunas Baru Lampung Tbk.,
546,TRIM,Trimegah Sekuritas Indonesia Tbk.,
544,BMSR,Bintang Mitra Semestaraya Tbk,
541,TIRT,Tirta Mahakam Resources Tbk,
514,SMDR,Samudera Indonesia  Tbk.,
509,BVIC,Bank Victoria International Tbk.,
505,CKRA,Cakra Mineral Tbk.,
476,AUTO,Astra Otoparts Tbk.,
470,RICY,Ricky Putra Globalindo Tbk,
464,JSPT,Jakarta Setiabudi Internasional Tbk.,
451,RBMS,Ristia Bintang Mahkotasejati Tbk.,
450,HITS,Humpuss Intermoda Transportasi Tbk.,
449,AALI,Astra Agro Lestari Tbk.,
448,ANTM,Aneka Tambang (Persero) Tbk.,
446,BHIT,MNC Investama Tbk.,
436,MAYA,Bank Mayapada Internasional Tbk.,
435,SSTM,Sunson Textile Manufacture Tbk,
434,JKSW,Jakarta Kyoei Steel Works Tbk.,
432,BKSL,Sentul City Tbk.,
431,LPCK,Lippo Cikarang Tbk,
429,LPGI,Lippo General Insurance Tbk.,
428,LTLS,Lautan Luas Tbk.,
423,MITI,Mitra Investindo Tbk.,
411,BCIC,Bank JTrust Indonesia Tbk.,
410,AISA,Tiga Pilar Sejahtera Food Tbk.,
406,IKAI,Intikeramik Alamasri Industri Tbk.,
405,ETWA,Eterindo Wahanatama Tbk,
399,SSIA,Surya Semesta Internusa Tbk.,
391,MIRA,Mitra International Resources Tbk.,
381,ALMI,Alumindo Light Metal Industry Tbk.,
380,SIPD,Sierad Produce Tbk.,
376,STTP,Siantar Top Tbk.,
369,BBNI,Bank Negara Indonesia (Persero) Tbk.,
360,PICO,Pelangi Indah Canindo Tbk,
359,SMSM,Selamat Sempurna Tbk.,
357,KDSI,Kedawung Setia Industrial Tbk.,
355,RALS,Ramayana Lestari Sentosa Tbk.,
345,CEKA,Wilmar Cahaya Indonesia Tbk.,
344,LSIP,PP London Sumatra Indonesia Tbk.,
343,CTTH,Citatah Tbk.,
341,LPKR,Lippo Karawaci Tbk.,
311,TLKM,Telekomunikasi Indonesia (Persero) Tbk.,
310,AMFG,Asahimas Flat Glass Tbk.,
307,ELTY,Bakrieland Development Tbk.,
305,BIPP,Bhuwanatala Indah Permai Tbk.,
304,TINS,Timah (Persero) Tbk.,
302,SMDM,Suryamas Dutamakmur Tbk.,
301,KONI,Perdana Bangun Pusaka Tbk,
297,MRAT,Mustika Ratu Tbk.,
292,BMTR,Global Mediacom Tbk.,
286,SMMA,Sinarmas Multiartha Tbk.,
278,TURI,Tunas Ridean Tbk.,
277,BUDI,Budi Starch & Sweetener Tbk.,
271,HEXA,Hexindo Adiperkasa Tbk.,
235,KKGI,Resource Alam Indonesia Tbk.,
234,SKLT,Sekar Laut Tbk.,
233,JIHD,Jakarta International Hotels & Development Tbk.,
231,BNBR,Bakrie & Brothers Tbk,
230,CMPP,Rimau Multi Putra Pratama Tbk.,
229,MERK,Merck Tbk.,
228,CTBN,Citra Tubindo Tbk.,
226,WICO,Wicaksana Overseas International Tbk.,
225,VOKS,Voksel Electric Tbk.,
223,UNTR,United Tractors Tbk.,
222,UNSP,Bakrie Sumatera Plantations Tbk.,
221,ULTJ,Ultra Jaya Milk Industry & Trading Company\, Tbk.,
219,TSPC,Tempo Scan Pacific Tbk.,
218,TRST,Trias Sentosa Tbk.,
214,TOTO,Surya Toto Indonesia Tbk.,
213,TMPI,Sigmagold Inti Perkasa Tbk.,
212,ASDM,Asuransi Dayin Mitra Tbk.,
210,TKGA,Permata Prima Sakti Tbk.,
209,TIRA,Tira Austenite Tbk,
208,TGKA,Tigaraksa Satria Tbk.,
207,TFCO,Tifico Fiber Indonesia Tbk.,
204,TCID,Mandom Indonesia Tbk.,
203,TBMS,Tembaga Mulia Semanan Tbk.,
201,SULI,SLJ Global Tbk.,
198,SRSN,Indo Acidatama Tbk,
197,SQBI,Taisho Pharmaceutical Indonesia Tbk.,
196,SPMA,Suparma Tbk.,
195,SONA,Sona Topas Tourism Industry Tbk.,
193,SMGR,Semen Indonesia (Persero) Tbk.,
192,SMCB,Holcim Indonesia Tbk.,
189,SIMA,Siwani Makmur Tbk,
188,SHID,Hotel Sahid Jaya International Tbk.,
186,SDPC,Millennium Pharmacon International Tbk.,
185,SCPI,Merck Sharp Dohme Pharma Tbk.,
184,SCCO,Supreme Cable Manufacturing & Commerce Tbk.,
182,RMBA,Bentoel Internasional Investama Tbk.,
181,RIGS,Rig Tenders Indonesia Tbk.,
180,RDTX,Roda Vivatex Tbk,
177,PWON,Pakuwon Jati Tbk.,
176,PUDP,Pudjiadi Prestige Tbk.,
175,PTSP,Pioneerindo Gourmet International Tbk.,
173,PSDN,Prasidha Aneka Niaga Tbk,
172,PRAS,Prima Alloy Steel Universal Tbk.,
171,POOL,Pool Advista Indonesia Tbk.,
170,POLY,Asia Pacific Fibers Tbk,
169,PNSE,Pudjiadi & Sons Tbk.,
168,PNLF,Panin Financial Tbk.,
167,PNIN,Paninvest Tbk.,
166,PNBN,Bank Pan Indonesia Tbk,
165,PLIN,Plaza Indonesia Realty Tbk.,
160,OMRE,Indonesia Prima Property Tbk,
159,NISP,Bank OCBC NISP Tbk.,
158,NIPS,Nipress Tbk.,
157,MYTX,Asia Pacific Investama Tbk.,
156,MYRX,Hanson International Tbk.,
155,MTSM,Metro Realty Tbk.,
154,MTFN,Capitalinc Investment Tbk.,
153,MTDL,Metrodata Electronics Tbk.,
152,MREI,Maskapai Reasuransi Indonesia Tbk.,
151,MLPL,Multipolar Tbk.,
149,MLIA,Mulia Industrindo Tbk,
148,MLBI,Multi Bintang Indonesia Tbk.,
147,MEDC,Medco Energi Internasional Tbk.,
146,MDRN,Modern Internasional Tbk.,
145,MDLN,Modernland Realty Tbk.,
142,MAMI,Mas Murni Indonesia Tbk,
141,LPPS,Lippo Securities Tbk.,
140,LPPF,Matahari Department Store Tbk.,
139,LPLI,Star Pacific Tbk,
138,LPIN,Multi Prima Sejahtera Tbk,
136,LMSH,Lionmesh Prima Tbk.,
135,LMPI,Langgeng Makmur Industri Tbk.,
134,LION,Lion Metal Works Tbk.,
133,KLBF,Kalbe Farma Tbk.,
131,KIJA,Kawasan Industri Jababeka Tbk.,
130,KICI,Kedaung Indah Can Tbk,
128,KBLM,Kabelindo Murni Tbk.,
127,KBLI,KMI Wire & Cable Tbk.,
126,KARW,ICTSI Jasa Prima Tbk.,
123,JPRS,Jaya Pari Steel Tbk,
121,JECC,Jembo Cable Company Tbk.,
119,ISAT,Indosat Tbk.,
118,INTP,Indocement Tunggal Prakarsa Tbk.,
117,INTD,Inter Delta Tbk,
116,INTA,Intraco Penta Tbk.,
113,INPC,Bank Artha Graha Internasional Tbk.,
112,INKP,Indah Kiat Pulp & Paper Tbk.,
111,INDS,Indospring Tbk.,
110,INDR,Indo-Rama Synthetics Tbk.,
109,INDF,Indofood Sukses Makmur Tbk.,
108,INCI,Intanwijaya Internasional Tbk,
106,INAI,Indal Aluminium Industry Tbk.,
105,IMAS,Indomobil Sukses Internasional Tbk.,
104,IKBI,Sumi Indo Kabel Tbk.,
103,IGAR,Champion Pacific Indonesia Tbk.,
100,HMSP,H.M. Sampoerna Tbk.,
99,HERO,Hero Supermarket Tbk.,
98,HDTX,Panasia Indo Resources Tbk.,
97,GSMF,Equity Development Investment Tbk.,
95,GJTL,Gajah Tunggal Tbk.,
93,GGRM,Gudang Garam Tbk.,
92,GDYR,Goodyear Indonesia Tbk.,
90,FASW,Fajar Surya Wisesa Tbk.,
89,FAST,Fast Food Indonesia Tbk.,
88,ESTI,Ever Shine Tex Tbk.,
87,ERTX,Eratex Djaja Tbk.,
86,EPMT,Enseval Putera Megatrading Tbk.,
85,EKAD,Ekadharma International Tbk.,
83,DVLA,Darya-Varia Laboratoria Tbk.,
82,DUTI,Duta Pertiwi Tbk,
80,DPNS,Duta Pertiwi Nusantara Tbk.,
78,DLTA,Delta Djakarta Tbk.,
77,DILD,Intiland Development Tbk.,
73,CPIN,Charoen Pokphand Indonesia Tbk,
71,CNTX,Century Textile Industry Tbk.,
68,CMNP,Citra Marga Nusaphala Persada Tbk.,
67,CFIN,Clipan Finance Indonesia Tbk.,
64,BUMI,Bumi Resources Tbk.,
62,BRNA,Berlina Tbk.,
61,BRAM,Indo Kordsa Tbk.,
57,BNLI,Bank Permata Tbk.,
56,BNII,Bank Maybank Indonesia Tbk.,
52,BIMA,Primarindo Asia Infrastructure Tbk.,
51,BFIN,BFI Finance  Indonesia Tbk.,
49,BBLD,Buana Finance Tbk.,
47,BATA,Sepatu Bata Tbk.,
45,ASRM,Asuransi Ramayana Tbk.,
44,ASII,Astra International Tbk.,
42,ASGR,Astra Graphia Tbk.,
41,ASBI,Asuransi Bintang Tbk.,
40,ARGO,Argo Pantes Tbk,
37,ALKA,Alakasa Industrindo Tbk,
36,AKRA,AKR Corporindo Tbk.,
35,AKPI,Argha Karya Prima Industry Tbk.,
34,AHAP,Asuransi Harta Aman Pratama Tbk.,
33,ADMG,Polychem Indonesia Tbk,
32,ADES,Akasha Wira International Tbk.,
31,ABDA,Asuransi Bina Dana Arta Tbk.,
25,BAYU,Bayu Buana Tbk,
24,BLTA,Berlian Laju Tanker Tbk,
23,SAFE,Steady Safe Tbk,
22,ZBRA,Zebra Nusantara Tbk,
21,PTRO,Petrosea Tbk.,
19,INCO,Vale Indonesia Tbk.,
18,SMRA,Summarecon Agung Tbk.,
17,JRPT,Jaya Real Property Tbk.,
16,CTRA,Ciputra Development Tbk.,
15,UNVR,Unilever Indonesia Tbk.,
14,UNIC,Unggul Indah Cahaya Tbk.,
13,TKIM,Pabrik Kertas Tjiwi Kimia Tbk.,
12,SMAR,Smart Tbk.,
11,PBRX,Pan Brothers Tbk.,
10,MYOR,Mayora Indah Tbk.,
9,MPPA,Matahari Putra Prima Tbk.,
7,JPFA,Japfa Comfeed Indonesia Tbk.,
5,DART,Duta Anggada Realty Tbk.,
4,BRPT,Barito Pacific Tbk.,
3,BNGA,Bank CIMB Niaga Tbk.,
1,BDMN,Bank Danamon Indonesia Tbk.,
